,title,year,genre,score,review
736,부산행,2016,"액션, 스릴러",6, 관람객 아쉬운 부분도 있지만.. 그래도 재미있게 봤음..공유가 아니라 마동석이 주인공같은데 ㅋㅋㅋ 
737,부산행,2016,"액션, 스릴러",8, 관람객 엄청나게재미이ㅆ네여 
738,부산행,2016,"액션, 스릴러",8, 관람객 대한민국영화 헐리웃 진출 가능성이 보입니다 
739,부산행,2016,"액션, 스릴러",9, 관람객 스릴잇고감동도있고 아주 재밋네요 
740,부산행,2016,"액션, 스릴러",10, 관람객 최초이자 최고의 한국형 좀비 영화 
741,부산행,2016,"액션, 스릴러",8, 관람객 재미있게 잘 보았습니다. 
742,부산행,2016,"액션, 스릴러",8, 관람객 한국좀비영화치고 괜찮은듯 
743,부산행,2016,"액션, 스릴러",9, 관람객 아주 재미있는 영화이다 
744,부산행,2016,"액션, 스릴러",9, 관람객 재미써요 짱이에여 !!!! 
745,부산행,2016,"액션, 스릴러",10, 관람객 두번봤는데도 재미있게 봤습니다~~~영화에 집중하고 빠져서봤네요^^ 
746,부산행,2016,"액션, 스릴러",10, 관람객 한국 영화의 발전된 모습을 보았다... 
747,부산행,2016,"액션, 스릴러",10, 관람객 재밌어요 또 보고싶어오 
748,부산행,2016,"액션, 스릴러",9, 관람객 좀비영화로서 손색이 없다. 
749,부산행,2016,"액션, 스릴러",7, 관람객 예고편에는 좀비가 자세히 나오지 않아 초등아이들이랑 같이가서 보다가 하도 무섭다고 해서 극장표만 날리고 왔네요 ㅠ 
750,부산행,2016,"액션, 스릴러",10, 관람객 진짜재밋게봣ㅇ?ㄱ요 스릴도잇고 한국영화좀비물이라고 별기대안하고봣는데 지니밋네요 
751,부산행,2016,"액션, 스릴러",10, 관람객 부산행은 무ㅜ 할말이잇나 재밋 
752,부산행,2016,"액션, 스릴러",10, 관람객 먼가짠하면서도 가족애를느낄수있는영화 
753,부산행,2016,"액션, 스릴러",10, 관람객 좋아너나아내주ㅗ흐아내 
754,부산행,2016,"액션, 스릴러",6, 관람객 전형적인 한국 영화ㅡㅡ 좀비 영화에 억지 감동을 넣으실려구 
755,부산행,2016,"액션, 스릴러",10, 관람객 너무너무 잘봤어요 좋아요 
756,부산행,2016,"액션, 스릴러",10, 관람객 그냥 그냥 재미있어요~^^ 
757,부산행,2016,"액션, 스릴러",9, 관람객 찐한부성애가 느껴지는 슬프면서도 감동잇는 영화인것같앗다. 
758,부산행,2016,"액션, 스릴러",10, 관람객 국내 좀비물이라 별기대없이 봤는데.. 재밌었다 
759,부산행,2016,"액션, 스릴러",10, 관람객 한국에서처음나온거치곤핵잼ㅎㅎ 
760,부산행,2016,"액션, 스릴러",10, 관람객 우리나라 좀비영화의 한 획을 그은 것 같습니다 
761,부산행,2016,"액션, 스릴러",9, 관람객 정말 스릴있다. 다시보고싶다. 
762,부산행,2016,"액션, 스릴러",9, 관람객 재밌었습니다 배우분들 연기도 인상적이었고한국 재난영화중에 제일 재밌게봤던거 같습니다개인적으로 해피엔딩을 좋아하는데 조금 아쉽네요 
763,부산행,2016,"액션, 스릴러",8, 관람객 무난하고 재밌게 봤음 추천해요 
764,부산행,2016,"액션, 스릴러",10, 관람객 무섭 오금저림 굉장히잼남 
765,부산행,2016,"액션, 스릴러",10, 관람객 꿀잼입니다 레알꿀잼입니다 
766,부산행,2016,"액션, 스릴러",10, 관람객 되게 재밌게 봤습니다~ 
767,부산행,2016,"액션, 스릴러",8, 관람객 스포만 아니였으면 재미있게 봤을 듯한 영화 
768,부산행,2016,"액션, 스릴러",10, 관람객 한국판 좀비물 재미있게 봤어용 
769,부산행,2016,"액션, 스릴러",9, 관람객 정말재밌게봤어요 기대했던것보다도 더 재밌었어요 짱! 
770,부산행,2016,"액션, 스릴러",9, 관람객 사람이 제일 무서움 그래도 짱짱 
771,부산행,2016,"액션, 스릴러",9, 관람객 굳^^~좀비연기가 실감났어요 
772,부산행,2016,"액션, 스릴러",9, 관람객 즐겁고 재미있게 봤습니다 
773,부산행,2016,"액션, 스릴러",10, 관람객 부산행 대박!정유미 겁나 이뻐요~ 
774,부산행,2016,"액션, 스릴러",10, 관람객 넘재밌다 좀비대박 마동석짱 
775,부산행,2016,"액션, 스릴러",10, 관람객 진짜 흡입하여 빨려들어갔어요~ 
776,부산행,2016,"액션, 스릴러",10, 관람객 엄청엄청재밋습니다 따봉 
777,부산행,2016,"액션, 스릴러",10, 관람객 좀비보다 사람이 더 무섭다 
778,부산행,2016,"액션, 스릴러",10, 관람객 별로 기대 안하고 봤는데 개꾸르잼이었습니다 
779,부산행,2016,"액션, 스릴러",10, 관람객 이혼이시대의유행처럼여겨지는요즘.최대희생양인어린자녀들..그러나부모들의밑바닥엔자식들의사랑으로깔려있었다.가족의소중함되새김질!!! 
780,부산행,2016,"액션, 스릴러",9, 관람객 새로운 장르 영화로 그래픽이 어색하지 않아요~ 
781,부산행,2016,"액션, 스릴러",9, 관람객 참신하고 좋았습니다 또 보고싶네요 
782,부산행,2016,"액션, 스릴러",10," 관람객 우리나라 영화라고 말할수 없을정도로 놀라며 봤다. 아무런 기대없이, 사전정보 전혀없이 봐서 더 그럴수도 있겠지만 좀비 영화를 이렇게 잘 만들수가... "
783,부산행,2016,"액션, 스릴러",10, 관람객 너무 재밋게 봤습니다. 
784,부산행,2016,"액션, 스릴러",9, 관람객 재밌게 잘 봤어요~~가족모두가 다 재밌게 봤어요 
785,부산행,2016,"액션, 스릴러",10, 관람객 좀비 실감나고 재밋엇어요 
786,부산행,2016,"액션, 스릴러",10, 관람객 이건뭐 더 말할것도 없이 ~ 잘만들었습니다. 새로운 장르를 이렇게 까지 만든거면 한국 영화의 발전도 멀지 않았습니다 !! 
787,부산행,2016,"액션, 스릴러",10, 관람객 .진짜 최고의 영화 입니다 한국판 영화중에 짱짱ㅇ 
788,부산행,2016,"액션, 스릴러",10, 관람객 오락영화로 이보다 좋을순 없다 
789,부산행,2016,"액션, 스릴러",6, 관람객 한국 좀비물치고 예상외로 재미잇엇어요 
790,부산행,2016,"액션, 스릴러",9, 관람객 좀비분들의 맹 활약과 주인공들마다 개성있는 캐릭터가 돋보였던 영화에요 한국형 좀비물의 미래를 보았고 영화 러닝타임 내내 지루하지 않고 흡입력있었습니다. 
791,부산행,2016,"액션, 스릴러",10, 관람객 재밌어요 지루하지 않고 집중있게 봤습니다 
792,부산행,2016,"액션, 스릴러",10, 관람객 한국영화는 잘안보는편인데 간만에 재밌게관람했어요~부산행 추천요^^ 
793,부산행,2016,"액션, 스릴러",7, 관람객 좀아쉬운감이있었지만완성도는높은듯요 
794,부산행,2016,"액션, 스릴러",8, 관람객 한국산 좀비물 치고 정말 잘만들었다는 생각이 드네요^^더욱 발전되는 좀비물 기대해봅니다. 
795,부산행,2016,"액션, 스릴러",5, 관람객 한국 좀비물 치고 잘 만들었음. 
796,부산행,2016,"액션, 스릴러",8, 관람객 조금은 애매한 좀비물이지않을까 
797,부산행,2016,"액션, 스릴러",9, 관람객 좀비물 좋아하는데 우리나라 좀비영화 더 많이 발전 기원 
798,부산행,2016,"액션, 스릴러",9, 관람객 부모는 다 똑같은 마음입니다.공유 아빠 가슴 아팠어요 
799,부산행,2016,"액션, 스릴러",8, 관람객 흥미진진한 영화였고 나름 볼만했어요 근데 몇몇의 장면에 오글거럈.. 
800,부산행,2016,"액션, 스릴러",10, 관람객 오랫만에 시간 가는줄 모르고 몰입해서 봤습니다~^^ 
801,부산행,2016,"액션, 스릴러",9, 관람객 재밌는데 좀 어이없기도함 
802,부산행,2016,"액션, 스릴러",8, 관람객 이 정도면 잘 만든거 같은데 
803,부산행,2016,"액션, 스릴러",9, 관람객 두번이나 봤는데 두번다 너무재밌게봤어요!한국좀비물중최고인듯.. 
804,부산행,2016,"액션, 스릴러",10, 관람객 한국에서의 대형좀비물 성공적인 작품이다 
805,부산행,2016,"액션, 스릴러",9, 관람객 재밌네요 기대를 만이 안하고 봐야함 
806,부산행,2016,"액션, 스릴러",9, 관람객 몰입감있고 빠른 전개가 좋았어요 
807,부산행,2016,"액션, 스릴러",8, 관람객 좀비 열연에 박수를 보냅니다. 
808,부산행,2016,"액션, 스릴러",7, 관람객 좀비영화 공이 많이 들어간거 같습니다. 
809,부산행,2016,"액션, 스릴러",10," 관람객 근래 본 최고의 영화, 우리나라도 좀비영화를 이렇게 잘 만들수 있다는 자신감을 보여주는 영화 "
810,부산행,2016,"액션, 스릴러",8, 관람객 좀비영화중에 승전결이 잘 되어있는 좀비영화 
811,부산행,2016,"액션, 스릴러",7, 관람객 우리나라에서 그래도 좀비영화라고 할수있는 영화가 나온것같다. 하지만 초반부터 좀비가 등장해 계속 기차에서만 싸우는 씬이 너무 길아사 지루했고 영화의 기승전결이 완벽하지 않았던거 같아서 아쉽다 
812,부산행,2016,"액션, 스릴러",9, 관람객 한구영화의 좀비라..의외였네여 
813,부산행,2016,"액션, 스릴러",8, 관람객 좀비물이 생소하지 않은 장르가 되었음에도 전혀 지루하지않았어요 ㅎㅎ 
814,부산행,2016,"액션, 스릴러",10, 관람객 한국 좀비물의 발전입니다. 상당히 표현력도 좋았고 한국인들 스러운 모습이었습니다. 
815,부산행,2016,"액션, 스릴러",8, 관람객 영화관에서 시청한지는 꽤 되었는데 집에서 다시 결제해서 시청함. 외국영화와 비교하는 글이 많은데 한국에서 이제 좀비물도 기대해볼 수 있는 발판이 되는 영화라 생각함 
816,부산행,2016,"액션, 스릴러",10, 관람객 한국의 좀비 영화 사상 단연 탑이라 재도 과언이 아닐 정도로 잘 만들어진 영화. 첫 탑승한 좀비 배우 부터 주인공 부녀도 연기 잘했지만 마동석씨 배우는 탁워한 존재감..부산행 모든 배우들 퍼펙트..좀비들도 굿..간만... 
817,부산행,2016,"액션, 스릴러",6," 관람객 개연성이 조금 떨어지는 게 흠... 특히 마지막 쯤에 공유 회상씬은 진짜,,, 그래도 좀비 액션은 디테일한 부분까지 너무 좋았던 것 같다 "
818,부산행,2016,"액션, 스릴러",10, 관람객 한국영화라서 크게 기대안했는데 재미있었단 
819,부산행,2016,"액션, 스릴러",10, 관람객 볼만한거 같아 걍 봐..볼거 없자너 
820,부산행,2016,"액션, 스릴러",8, 관람객 결말이 약간 허무했으나 진행중에는 재밌게 봤어요 
821,부산행,2016,"액션, 스릴러",10, 관람객 지하철타고다니는데 출퇴근이 무서워요 
822,부산행,2016,"액션, 스릴러",10, 관람객 보는내내 흥미로웟어요~우리나라에서 좀비영화라니! 새로운 시도에 박수를 보냅니다^^ 
823,부산행,2016,"액션, 스릴러",10, 관람객 재밌다 굿굿 좀비들이 리얼하다 
824,부산행,2016,"액션, 스릴러",10, 관람객 우리나라 최고의 좀비영화!!!! 
825,부산행,2016,"액션, 스릴러",10, 관람객 한국의 좀비물 새로운장을 여느 영화엿음 
826,부산행,2016,"액션, 스릴러",8, 관람객 재미있게잘봤습니다! 
827,부산행,2016,"액션, 스릴러",10, 관람객 기대하지 않고 갔는데 무섭고 재미있었어요 
828,부산행,2016,"액션, 스릴러",7," 관람객 좀 뻔하긴 하지만, 배우들의 연기가 몰입도를 높여주는 영화 "
829,부산행,2016,"액션, 스릴러",8, 관람객 시간때우기좋은영화임 ㅎㅎ재밌음 
830,부산행,2016,"액션, 스릴러",10, 관람객 겁나 재밌게 잘 봤습니다. 
831,부산행,2016,"액션, 스릴러",10, 관람객 재밋어요!오오오옹ㅇㅇ 
832,부산행,2016,"액션, 스릴러",10, 관람객 꿀잼핵잼빅잼호날두잼 
833,부산행,2016,"액션, 스릴러",8, 관람객 재밌습니다재밌어요굳 
834,부산행,2016,"액션, 스릴러",10, 관람객 너무재미있어요ㅠㅠㅠ다시보고시픈영화입니다 
835,부산행,2016,"액션, 스릴러",8, 관람객 잘 만든 영화입니다...한국영화 의 무궁한 발전을 기대해봅니다 
836,부산행,2016,"액션, 스릴러",10, 관람객 별기대안하고봣는데 너무재미있게봣습니다 
837,부산행,2016,"액션, 스릴러",10, 관람객 그런대로 볼만합니다~~~ 
838,부산행,2016,"액션, 스릴러",8, 관람객 생각했던 것보다 볼만 했습니다. 좀비도 그리 어색하지도 않았고요. 
839,부산행,2016,"액션, 스릴러",9, 관람객 재미있게 잘 봤어요오오오오~ 
840,부산행,2016,"액션, 스릴러",8, 관람객 한국에서 이정도의 좀비물을 만들었다는것에 초첨을 두는게 좋을것 같다. 앞으로의 성장을 기대해본다 
841,부산행,2016,"액션, 스릴러",9, 관람객 기대를 전혀 하지않고 봐서 그런지 최근 본 영화중 제일 괜찮았음 
842,부산행,2016,"액션, 스릴러",10, 관람객 좀비영화좋아하는데.. 정말재미있게봤어요 
843,부산행,2016,"액션, 스릴러",9, 관람객 한국영화도 이제 너무 잘만든다 
844,부산행,2016,"액션, 스릴러",10, 관람객 진짜 너무 재밌음 좀비물이 외국영화랑 비교해도 손색없을정도로 진짜 무서웠음 
845,부산행,2016,"액션, 스릴러",10, 관람객 좀비 연기하신분들에게 박수를 보냅니다. 재미있었어요! 
846,부산행,2016,"액션, 스릴러",8, 관람객 한국에서도 이런 좀비물을 찍을 수 있구나. 감탄한 영화. 내용은 뭐.... 
847,부산행,2016,"액션, 스릴러",9, 관람객 꿀잼 꾸르잼잼 꾸르잼잼잼 허니잼잼 
848,부산행,2016,"액션, 스릴러",9," 관람객 한국 좀비 블록버스터의 첫 시작, 속도감과 빠른 전개 그리고, 열차안의 사람들 강등 표현이 좋았다 하지만, 뜬금 없는 대화가 몇몇 보였다. "
849,부산행,2016,"액션, 스릴러",8, 관람객 많은 생각을 하게하네요 
850,부산행,2016,"액션, 스릴러",6, 관람객 좀비를 넘 싫어 그런지 별로였지만 공유가 아이와 헤어질때의 모습은 넘 가슴 찡했습니다. 
851,부산행,2016,"액션, 스릴러",8, 관람객 좀비영화일좋아하는데 이건 재밌었어요 
852,부산행,2016,"액션, 스릴러",10, 관람객 김의성을 국회로보냅시다 
853,부산행,2016,"액션, 스릴러",9, 관람객 재미있았어요 엄마랑 봤는데 
854,부산행,2016,"액션, 스릴러",10, 관람객 정말 지루하지않은 영화였어요!! 
855,부산행,2016,"액션, 스릴러",10, 관람객 무섭다기 보다 슬픈 가족영화아이와 봐도 손색없는 재미진 영호ㅓ 
856,부산행,2016,"액션, 스릴러",8, 관람객 가족의 소중함을 생각하게하는 영화다 타만 무리수를 둔 영응주의는 현실감을 떨어뜨리게한다 
857,부산행,2016,"액션, 스릴러",10, 관람객 기다이상으로 잼있어요 진짜ㅋㅋ 
858,부산행,2016,"액션, 스릴러",6, 관람객 한정된 공간안에서의 박진감 넘치는 전개로 흥미로운 영화.. 한국형좀비물이라는 단어가 정말 적절했다 
859,부산행,2016,"액션, 스릴러",9, 관람객 부산가는 기차 탈때마다 생각 날듯 
860,부산행,2016,"액션, 스릴러",9, 관람객 재밋어요 역시천만 영화 
861,부산행,2016,"액션, 스릴러",10, 관람객 기대하지 않고 봤는데 재밌게 잘 봤습니다 
862,부산행,2016,"액션, 스릴러",9, 관람객 긴장감 넘치고 재밌었어요. 내용의 앞뒤를 좀더 많이 설명해줬다면 더 좋았을것같아요 ! 
863,부산행,2016,"액션, 스릴러",9, 관람객 공유땜에보다가마동석에반함 
864,부산행,2016,"액션, 스릴러",8, 관람객 결말다알고봤는데도볼만했어요 잘만든 좀비영화 
865,부산행,2016,"액션, 스릴러",9, 관람객 잘봤어요 기대이상입니다 
866,부산행,2016,"액션, 스릴러",7, 관람객 좀비 보고 시원하게 보고가요 
867,부산행,2016,"액션, 스릴러",9, 관람객 너무재밌게보았ㅇ니요 
868,부산행,2016,"액션, 스릴러",5, 관람객 재밋게봣엇지요ㅋㅋㅋ 
869,부산행,2016,"액션, 스릴러",9, 관람객 재밋어요 마블리*.* 
870,부산행,2016,"액션, 스릴러",9, 관람객 아이 울때 옆에서 남편 거의 통곡함(눈물 별로 없는 타입)여러가지로 볼거리가 풍성 ^^ 
871,부산행,2016,"액션, 스릴러",10," 관람객 한국에서도 이런영화를 만들수있구나 생각했구, 참잘만들었네요. 공유의 연기는 물론 마동석아저씨 연기 정말좋았어요. "
872,부산행,2016,"액션, 스릴러",10, 관람객 꿀잼개잼개꿀잼리얼잼 
873,부산행,2016,"액션, 스릴러",9, 관람객 스릴있고 재밌게 봤습니다 
874,부산행,2016,"액션, 스릴러",7, 관람객 재밌어요 왜 그런지 이유는 설명안해주지만... 
875,부산행,2016,"액션, 스릴러",10, 관람객 지루하지않는영화네요 
876,부산행,2016,"액션, 스릴러",9, 관람객 좀비영화를 너무 좋아해서 갔는데..그런데 좀색다른 좀비를 보니 넘마음에 들었어요.. 
877,부산행,2016,"액션, 스릴러",10, 관람객 각박한 현실사회 속 정에 대해 생각해 보게 되고 이 사회에 대해 생각해 보게 되는 영화 
878,부산행,2016,"액션, 스릴러",10, 관람객 재밋당 진심 명작입니다 굳굳 
879,부산행,2016,"액션, 스릴러",9, 관람객 보는내내심장이두근두근..ktx탈때마다배우들얼굴계속생각남 
880,부산행,2016,"액션, 스릴러",10, 관람객 정말대단한 영화입니다 
881,부산행,2016,"액션, 스릴러",8, 관람객 재미있어요재미있어요 
882,부산행,2016,"액션, 스릴러",5, 관람객 그냥.보통이네여 .마동석.아이빼곤 
883,부산행,2016,"액션, 스릴러",9, 관람객 마지악에공유가죽는장면에서눈물이ㅜㅜ딸을위해서 
884,부산행,2016,"액션, 스릴러",9, 관람객 좀지나긴햇지만 좀비한국상륙에 약간늘랏고 빠른전계에제밋게봣어요.막판에 눈물이찜끔~~ 
885,부산행,2016,"액션, 스릴러",10, 관람객 마동석짱짱맨 ㅋㅋㅋㅋ 
886,부산행,2016,"액션, 스릴러",10, 관람객 너무징그러웠지만 정말재밌게봤어요공유사랑해요 
887,부산행,2016,"액션, 스릴러",9, 관람객 한국 좀비영화 신선했습니다 ㅋ 
888,부산행,2016,"액션, 스릴러",8, 관람객 스릴있구재밌어요 반전에반전~ 한번씩은볼만한 영화~~ 다죽고 아이와 임산부만..좀허무 
889,부산행,2016,"액션, 스릴러",7, 관람객 기대안하고봤는데 스릴넘치고 재미있었어요 
890,부산행,2016,"액션, 스릴러",10, 관람객 매우재밌어요 진짜 또보고싶어 
891,부산행,2016,"액션, 스릴러",10, 관람객 재밌었어요! 올레티비로라도 꼭보세요. 
892,부산행,2016,"액션, 스릴러",9, 관람객 완전 재밌는데 마지막에 2사람까지 다 죽으면 진짜 신의 한 수일텐데 아쉬움..너무 나쁜 발상인가? ㅋㅋ 
893,부산행,2016,"액션, 스릴러",6, 관람객 분장 잘했음. 쨈 나게 봄. 마지막에 자식을 위해서 맘이 짠 했음. 
894,부산행,2016,"액션, 스릴러",8, 관람객 재밌어요!!!한국형좀비 신선했어요 
895,부산행,2016,"액션, 스릴러",8, 관람객 왜 낮에 찍었을까 저녁이였으면 좀더 괜찮았을텐데 
896,부산행,2016,"액션, 스릴러",10, 관람객 너무너무재밋게본영화 
897,부산행,2016,"액션, 스릴러",5, 관람객 오랫만에 쫄깃한 좀비물ㅋㅋㅋ 
898,부산행,2016,"액션, 스릴러",10, 관람객 굿굿 공유 한국식 좀비 짱 
899,부산행,2016,"액션, 스릴러",9, 관람객 재밌었음 10자102ㅏ102ㅏ102ㅏ 
900,부산행,2016,"액션, 스릴러",8, 관람객 무서운 건 역시 좀비보단 사람. 
901,부산행,2016,"액션, 스릴러",9, 관람객 영화보고나와서 군인을 봤는데 갑자기 거리감 느껴졌던..그래도 한국의 좀비물 앞으로도 더 성공했으면! 
902,부산행,2016,"액션, 스릴러",7, 관람객 좋아요 볼만해요 부담없이 볼만합니다 
903,부산행,2016,"액션, 스릴러",10, 관람객 좀비영화지만 다룬영화들과는 좀달랐던것같다. 
904,부산행,2016,"액션, 스릴러",7, 관람객 한국 최초 좀비 영화 치곤 잘 만들었음 
905,부산행,2016,"액션, 스릴러",9, 관람객 공유랑 아이의 연기가 재밌었음 
906,부산행,2016,"액션, 스릴러",6, 관람객 좀비영화라는 생각이 먼저들고 이기적인 인간들의 삶이 다소 교훈적입니다 
907,부산행,2016,"액션, 스릴러",10, 관람객 좀비 영화를 잘 만든거 같다 내용은 그닥 
908,부산행,2016,"액션, 스릴러",8, 관람객 본지꽤지났는데이제등록함 
909,부산행,2016,"액션, 스릴러",8, 관람객 기차탈때마다 좀비 생각을 하게 되고 연기가 훌륭하다 
910,부산행,2016,"액션, 스릴러",8, 관람객 엄마랑 긴장감있게 봤어요~ 
911,부산행,2016,"액션, 스릴러",9, 관람객 재미있게 봤어요 베스트5에요 
912,부산행,2016,"액션, 스릴러",10, 관람객 생각보다 재밌게 봤어요 
913,부산행,2016,"액션, 스릴러",10, 관람객 구태여 한국영화에나온 신파적장면을 비하할필요없다 그것이 한국영화의 스타일이라면 이영화는 웰메이드 코리안 좀비영화일테니까 
914,부산행,2016,"액션, 스릴러",9, 관람객 우리나라 좀비영화치고 진짜 재미있음~ 극장가서 보고 후회안함 
915,부산행,2016,"액션, 스릴러",8, 관람객 스릴넘치고 재미있게 봤어요 
916,부산행,2016,"액션, 스릴러",9, 관람객 좋았습니다. 한국 좀비영화치고 볼만함 
917,부산행,2016,"액션, 스릴러",8, 관람객 우리나라에 이런 일이 일어나지 않았으면... 
918,부산행,2016,"액션, 스릴러",8, 관람객 그냥저냥 재미있게 봤습니다 
919,부산행,2016,"액션, 스릴러",7, 관람객 한국영화의 가능성을 보여준 영화라고 보면 될듯합니다. 살짝 아쉬운 부분도 있었지만 전체적으로 무난했네요~ 
920,부산행,2016,"액션, 스릴러",10, 관람객 시나리오구성전개전반적으로좋았다재미긴장감배우의연기력굿굿추천영화 
921,부산행,2016,"액션, 스릴러",10, 관람객 시간가는줄몰랐습니다 
922,부산행,2016,"액션, 스릴러",8, 관람객 멋있다. 마동석. 간지난다. 
923,부산행,2016,"액션, 스릴러",10, 관람객 새오운 장르의 영화를 보는 듯한 나름 신선한 소재의 영화 인듯. 
924,부산행,2016,"액션, 스릴러",8, 관람객 부산행 보고난이후 부산행기차탈때마다 영화생각남 
925,부산행,2016,"액션, 스릴러",10, 관람객 재밌어 그리고 재밌어 그리고 
926,부산행,2016,"액션, 스릴러",10, 관람객 울며 웃으며 올만에 감동하며본영화였어요!! 
927,부산행,2016,"액션, 스릴러",10, 관람객 진짜 재밋다 너무너무 재밋다 
928,부산행,2016,"액션, 스릴러",10, 관람객 좀비영화는 돈많은 헐리우드에서나 가능한 줄 알았는데 한국서도 충분히 가능하다는 걸 깨닫게 해준 영화배경이 익숙한 KTX라 더 현실감 있었다는...^^ 
929,부산행,2016,"액션, 스릴러",10, 관람객 흔한 사랑얘기가 안나와서 좋았어요 
930,부산행,2016,"액션, 스릴러",10, 관람객 재미를 잃지 않은 좀비 유쾌한 좀비 
931,부산행,2016,"액션, 스릴러",10, 관람객 아 넘나 재밌아요 인생작품 ㄷㄷ 
932,부산행,2016,"액션, 스릴러",10, 관람객 재밋엇음 공유 죽는거 가슬픔 
933,부산행,2016,"액션, 스릴러",10, 관람객 스릴있고 한국좀비영화인데 굿이네요ㅎ 
934,부산행,2016,"액션, 스릴러",9, 관람객 한국에서 좀비영화가 꽤 잘 만들어진건 이례적이고 흥행 한 것도 대단하다 스릴있고 감동도 있는 영화로 추천합니다 
935,부산행,2016,"액션, 스릴러",8, 관람객 한국답게 만들었네요. 
936,부산행,2016,"액션, 스릴러",8, 관람객 한국산 좀비영화~~! 
937,부산행,2016,"액션, 스릴러",10, 관람객 재밋어연ㅎㅎ너무너무재밋어연 
938,부산행,2016,"액션, 스릴러",8, 관람객 재밌게 자알보아습니다 
939,부산행,2016,"액션, 스릴러",8, 관람객 그냥저냥 나름재밌었인ㅁ 
940,부산행,2016,"액션, 스릴러",7, 관람객 바이러스가 어떻게 형성되어 사람들이 좀비가 되었는지 부분이 추리가 되지 않아 조금 아쉬웠어요 
941,부산행,2016,"액션, 스릴러",9, 관람객 한국에서 보기 드문 좀비형 블록버스터.... 전반적으로 잘빠진 영화입니다 
942,부산행,2016,"액션, 스릴러",10, 관람객 괜찮았어요~~최고최고 
943,부산행,2016,"액션, 스릴러",5, 관람객 너무 억지설정이고 신파조네요 
944,부산행,2016,"액션, 스릴러",6, 관람객 그냥 볼만한게 끝 인 영화 나한테는 맞지않았음 
945,부산행,2016,"액션, 스릴러",7, 관람객 그냥 그랬어요 갠적으로 좀비같은거 허구적인거 별로 않좋아해서?? 걍 재미로보기좋을듯 
946,부산행,2016,"액션, 스릴러",10, 관람객 좋다!재밋다!감동이다!스릴만전!!! 
