,title,year,genre,score,review
351,부산행,2016,"액션, 스릴러",10, 관람객 재미가 무진장 있다기대이상이다 
352,부산행,2016,"액션, 스릴러",10, 관람객 한국형 재난영화 재밌습니다 
353,부산행,2016,"액션, 스릴러",6, 관람객 별스토리 없는 영화스토리전개가 너무 심심한 영화왠지 실망하는 분들 많을듯갠적으로 좀비영화 즐겨보는데 조금 실망함 
354,부산행,2016,"액션, 스릴러",7, 관람객 워킹데드 월드워지 같은거 좋아라하니 괜찮았던듯.. 아쉬운 부분 느슨한 부분 있지만 공유 마동석 연기 보는 재미가... 예전 탐 크루즈 이우주전쟁 비슷한 부분도 있고.. 신파코드만 없었어도 얼마나 좋았을꼬 
355,부산행,2016,"액션, 스릴러",1, 관람객 못봤네요 사고나서 슬픕니다 환불이안되서 ㅠㅠ 
356,부산행,2016,"액션, 스릴러",1, 관람객 ???내가 너무 어이없어서 좀비될뻔 
357,부산행,2016,"액션, 스릴러",1, 관람객 노잼 시간낭비 감성팔이 
358,부산행,2016,"액션, 스릴러",1, 관람객 동석이형빼면 볼거없음 
359,부산행,2016,"액션, 스릴러",10, 관람객 생각보다 재밌었어요! 
360,부산행,2016,"액션, 스릴러",7, 관람객 좀지루하네요ㅎㅅㅎ 재밌긴한데 
361,부산행,2016,"액션, 스릴러",6, 관람객 그냥그랭ㆍtidt공유땜시보았음 
362,부산행,2016,"액션, 스릴러",1, 관람객 넘 ~!!!! 사기쳤네요이런걸 그렇게 휘황차게 선전하다니...기분이 넘나빠서 뭘마실수도 먹을수도.잠을잘수도 없네완전싸구려.기분똥같군~!! 
363,부산행,2016,"액션, 스릴러",1, 관람객 정말쓰레기같은영화 왜평점이높지 
364,부산행,2016,"액션, 스릴러",1, 관람객 하... 할말이 없....쓸데없이 깜짝만 몰래다 목에 담만 걸리고 나옴..휴 
365,부산행,2016,"액션, 스릴러",1, 관람객 최악의 영화.. 0점주고싶었는데 최소점수가 1점이여서 1점준다. 
366,부산행,2016,"액션, 스릴러",1, 관람객 왜 0점이 없나요;;; 
367,부산행,2016,"액션, 스릴러",1, 관람객 신파로 떡칠 된 영화.. 
368,부산행,2016,"액션, 스릴러",1, 관람객 마동석 재밌네 ㅎ 영화끝. 
369,부산행,2016,"액션, 스릴러",6, 관람객 슬퍼요 아버지존재에 대해 생각하게되요 
370,부산행,2016,"액션, 스릴러",10, 관람객 한국영화의새로운장을연것같아서너무좋았습니다 
371,부산행,2016,"액션, 스릴러",10, 관람객 재미있게봤습니다 감사합니다 
372,부산행,2016,"액션, 스릴러",10, 관람객 부산여행을 가본 적이 없는데 앞으로도 없을 듯 
373,부산행,2016,"액션, 스릴러",10, 관람객 앞 부분을 살짝 놓치고 봐서 무척 아쉽지만 웬만한 헐리우드 좀비영화보다 훨씬 수준있었다.재밌게 봤다. 
374,부산행,2016,"액션, 스릴러",8, 관람객 공유...는 사랑입니다♡ 
375,부산행,2016,"액션, 스릴러",10, 관람객 정말 재밌어요! 두번 봤어요! 
376,부산행,2016,"액션, 스릴러",10, 관람객 한국영화가이정도면대단하죵 
377,부산행,2016,"액션, 스릴러",8, 관람객 재밌었어요매우매우매우~~ 
378,부산행,2016,"액션, 스릴러",6, 관람객 쏘쏘.. 아직 한국영화는 멀었다. 억지감동..ㅡㅡ 
379,부산행,2016,"액션, 스릴러",5, 관람객 한국형 좀비물이라는데만의의가있고개연성이너무 떨어져요... 
380,부산행,2016,"액션, 스릴러",3, 관람객 작품성을 찾아 볼 수 없는 졸작 
381,부산행,2016,"액션, 스릴러",2, 관람객 Soso 그냥 그래요 주인공은 좀비로 빨리 안변하고 여튼 ... 
382,부산행,2016,"액션, 스릴러",8, 관람객 지루하지 않은 전개. 볼만함 
383,부산행,2016,"액션, 스릴러",9, 관람객 정말ㄹ 배우분들 다들 수고하셨어요 주조연 가리지 않고 빛났던 영화 
384,부산행,2016,"액션, 스릴러",9, 관람객 우선 서글픈 생각이 든다.가족이라는 가장 따뜻한 단어가 또 있을까부산행을 보며 따뜻한 인간애의 모습과 사악한 인간들의대립속에서 이시대를 살아가는 우리들의 주변 인간사의 모습이 아닐까 하는 생각이든다 
385,부산행,2016,"액션, 스릴러",10, 관람객 정말후회않드는영화돈아깝지않은영화최고의영화추천합니다 
386,부산행,2016,"액션, 스릴러",10, 관람객 기대 이상의 작품이에요 
387,부산행,2016,"액션, 스릴러",10, 관람객 한국영화의 무궁한발전♥ 재밌게 잘봤어요 마동석 짱ㅋㅋ 
388,부산행,2016,"액션, 스릴러",10, 관람객 짱잼 존잼 진짜잼~!~! 더운 날씨에 가볍게 볼 수 있는 영화 깜짝 깜짝 놀라서 재밌고 스릴 넘치고 오랜만에 즐겁게 봤어용 
389,부산행,2016,"액션, 스릴러",10, 관람객 우리나라에서 이정도 퀄리티 좀비영화가 나올줄몰랐네요 정말재밌게잘봤습니다~ 
390,부산행,2016,"액션, 스릴러",3, 관람객 생각보다 실망스러운 구성과 스토리 
391,부산행,2016,"액션, 스릴러",6," 관람객 마동석 짱 멋있음..수안이 노래들으면서 울고있었는데,헉!!끝나버림..(허무함) "
392,부산행,2016,"액션, 스릴러",4, 관람객 뭐랄까 좀비자체를 부각하기보단 인간의 이기심에 집중한 듯하다 좀 억지스러운 것도 있고 
393,부산행,2016,"액션, 스릴러",5, 관람객 별로다 내용도 없다 내 시간이 아깝다. 
394,부산행,2016,"액션, 스릴러",3, 관람객 그나마 마동석 정유미 때문에 3점이네요~칸은 왜 이영화를 호평한건지~?? 숨겨진 진실과 반전에 대한 기대가 컷던 탓인지 그만큼 실망도 크네요~ 
395,부산행,2016,"액션, 스릴러",5, 관람객 개인적으로는 그닥.. 보통입니다. 간혹 깜짝 놀라긴했지만 
396,부산행,2016,"액션, 스릴러",3, 관람객 내용은 괜찮으나 결말은 실망이에요 
397,부산행,2016,"액션, 스릴러",2, 관람객 암만 그래도 개연성 1도 없는 억지전개는 정말 너무한거 아니냐 ? 
398,부산행,2016,"액션, 스릴러",10, 관람객 마동석이 살리네... 
399,부산행,2016,"액션, 스릴러",10, 관람객 진심캐꿀잼 아저씨 짜증남 ㅡㅡ 
400,부산행,2016,"액션, 스릴러",8, 관람객 나쁘진 않음 근데 굳이 돈주고 볼 필요는 못느낌 
401,부산행,2016,"액션, 스릴러",8, 관람객 캬아아ㅏ아앙아아ㅏㅇ아 
402,부산행,2016,"액션, 스릴러",10, 관람객 한국좀비영화에대한 기대를별로안했는데 넘나재밌었구요 가족애도생각났구요 감동도있구 좋았어요 
403,부산행,2016,"액션, 스릴러",10, 관람객 완전 재밌습니다. 좀비영화 짱 
404,부산행,2016,"액션, 스릴러",10, 관람객 굿굿굿!!!잼났어요^^ 
405,부산행,2016,"액션, 스릴러",10, 관람객 마동석 진짜ㅋ하드캐리ㅋㅋㅋ 
406,부산행,2016,"액션, 스릴러",10, 관람객 좀비물을 너무 좋아하는데 우리나라에서 만든 영화치곤 잘한듯 
407,부산행,2016,"액션, 스릴러",10, 관람객 히트다히트!!!!ㅎㅎ 
408,부산행,2016,"액션, 스릴러",10, 관람객 수안이 노랫소리가 동굴에 울려퍼지는 엔딩이참좋았다...영화내내 놀라 소리지르는 바람에 같이간 두아이가엄마때문에 더 놀랬다고...즐거운 시간이었어요~~^^ 
409,부산행,2016,"액션, 스릴러",6, 관람객 짜임새나 내용이 탄탄함이 떨어짐. 
410,부산행,2016,"액션, 스릴러",10, 관람객 좀비영화중 최고의 영화입니다. 
411,부산행,2016,"액션, 스릴러",9, 관람객 일단 아이와 공유의 부녀지간 연기 가슴 찡해서 눈물흘렸고 마쁜이 배우님 연기 물오르신듯ㅋㅋ애드리브같은데 너무자연스러워서 중간중간 웃으며 재미있게봣고 모든배우분들도 연기 굿굿ㅎㅎ 마지막으로 인간의 욕망으로 세상이 망... 
412,부산행,2016,"액션, 스릴러",9, 관람객 깜짝놀랐습니다 믿고보는 마동석 
413,부산행,2016,"액션, 스릴러",4, 관람객 한국에서 좀비라는 소재로 영화가 나와 신선하다고 느꼈는데관람 후 생각보다 진부한 내용에 실망했습니다.개연성 없이 극적인 장면들을 집어넣다보니 오히려 산만하고 몰입도도 떨어집니다. 
414,부산행,2016,"액션, 스릴러",3, 관람객 딱히 추천하고 싶지않은 영화 비추 
415,부산행,2016,"액션, 스릴러",3, 관람객 하..안소희 연기 극혐 . 
416,부산행,2016,"액션, 스릴러",3, 관람객 올해 들어 본 영화 중 최악. 1. 팔아버린 개연성 2. 어색하기 짝이 없는 작위적 대사 3. 지루한 전개 4. 눈물 짜내기 스토리 5. 짜증나는 인간 모습 계속 나옴/ 그나마 장점 1. 한국의 좀비물 2. KTX특... 
417,부산행,2016,"액션, 스릴러",10, 관람객 우리나라에도 좀비영화가 가능하다는것을 잘보여준 작품 
418,부산행,2016,"액션, 스릴러",10, 관람객 한국 좀비영화 퀄리티 내용에 만점줍니다 
419,부산행,2016,"액션, 스릴러",10, 관람객 역시공유 국민배우입니다 영화잘봣습니다!!! 
420,부산행,2016,"액션, 스릴러",10, 관람객 박진감넘치고 끝까지 긴장하게 만드는 영화임. 한국의 정서인 아버지의 부정이 눈물나게 만들고 생사를 오가는 시기에도 인간으로서의 예의를 잃지않는 사람들의 모습이 인상적이었음. . 
421,부산행,2016,"액션, 스릴러",8, 관람객 스토리 구성이 너무나 심하게없고 엉성함 
422,부산행,2016,"액션, 스릴러",10, 관람객 빠른전개와 스피드~ 정말 손에 땀을 쥐며 가슴 졸이며 봤어요~ 너무나 재미있게 봤습니다~ 아쉬운 결말이였지만 아빠의 사랑도 같이덤으로느끼게해준 영화였어요~ 중간 중간 좀비들이 너무잔인하고 무섭기까지~아직까지 좀비의 ... 
423,부산행,2016,"액션, 스릴러",10, 관람객 부산행열차~~더운여름무더위날릴아이스한영화네여~~좀비역활맡으신분들수고했어여ㅋㅋ 
424,부산행,2016,"액션, 스릴러",10, 관람객 재밌네요 ㅎㅎㅎㅎ 대박조짐?? 
425,부산행,2016,"액션, 스릴러",9, 관람객 재미있게 봤습니다. 공유 연기가 돋보이네요 
426,부산행,2016,"액션, 스릴러",9, 관람객 시작부터 2시간 내내 쫄깃한 영화입니다 
427,부산행,2016,"액션, 스릴러",10, 관람객 정유미의 힘빼는 연기가 너무 좋더라 난!!!! 
428,부산행,2016,"액션, 스릴러",10," 관람객 와,,사람이 극한상황에서 어떻게 변하는지 잘볼수있엇네요 ㄷㄷㄷ "
429,부산행,2016,"액션, 스릴러",10, 관람객 감동적이었어요마지막 공유 아빠의 모습 잊을 수가 없네요마동석도 마찬가지구요사랑하는 사람들을 위해서라면 .... 
430,부산행,2016,"액션, 스릴러",9, 관람객 마블리 공유 믿고보는영화입니다 잼나요 
431,부산행,2016,"액션, 스릴러",8, 관람객 공유 명품 연기 지리고요ㅎㅎ 소희 아역 발연기는 진짜 ㄷㄷㄷ.. 한국 좀비영화라서 큰 기대 안햇는데 자연스럽게 잘 연출햇네요. 웃프면서 반전도 있고 추천!! 
432,부산행,2016,"액션, 스릴러",9, 관람객 국산 좀비영화의 새로운 획을 긋는 영화인듯합니다. 하지만 스토리의 구성력은 아쉽습니다. 
433,부산행,2016,"액션, 스릴러",10, 관람객 팝콘 먹은거 반 흘린거반 
434,부산행,2016,"액션, 스릴러",1, 관람객 마형애드립빼고는 재미없었습니다ㅠ 
435,부산행,2016,"액션, 스릴러",1, 관람객 뻔한스토리 10자 10자 
436,부산행,2016,"액션, 스릴러",10, 관람객 마동석 너무 좋다ㅋㅋㅋ 공유 졸라 멋있고 정유미 존예 
437,부산행,2016,"액션, 스릴러",10, 관람객 2016년 곡성에 놀라고 부산행으로 한번 더 감동하네요. 8월 '서울역'도 기대해봅니다. 연상호 감독의 기존작들도 찾아보게 되네요. 천만영화 부산행. 감히 예상해봅니다. 
438,부산행,2016,"액션, 스릴러",8, 관람객 국내영화로 좀비영화 재밌었습니다.공유가 좀비가 되는것이 너무 아쉬웠습니다 
439,부산행,2016,"액션, 스릴러",10, 관람객 스릴넘쳣어요~~~~!!! 
440,부산행,2016,"액션, 스릴러",10, 관람객 페북에서 스포당해서 별기대안하고봤는데 완전 재미있고 슬프고 화나고 웃기고 특히 엔딩이 다른사람들은 별로라했는데 난 개인적으로 엄청 마음에 들었음 흥해라 부산행 
441,부산행,2016,"액션, 스릴러",1, 관람객 첨부터 끝까지 무슨 내용인지 도통 너무실망햇어요ㅜㅜ들뜬마음으로 영화보러갔었는는데...여태껏 본 영화중에 최고로 재미없었어요 ㅜ 
442,부산행,2016,"액션, 스릴러",1, 관람객 돈주고보기아깝다정말 
443,부산행,2016,"액션, 스릴러",1, 관람객 전 별로였습니다. 너무 기대를 해서 그런가? 
444,부산행,2016,"액션, 스릴러",10, 관람객 공유.. 넘 멋져요 좋아요 
445,부산행,2016,"액션, 스릴러",8, 관람객 재밌고 공유 존잘보스.. 
446,부산행,2016,"액션, 스릴러",9, 관람객 재밌게 봤구요 공유가 죽어 아쉬워요 ㅠㅠ 
447,부산행,2016,"액션, 스릴러",9, 관람객 우리나라의 정서에 맞게 잘 짜여진 좀비물 이였던것 같다. 하지만 장소가 한정적인 부분이 아쉬웠지만 감독의 의도된 바는 열차내의 좁은 공간에서의 압박과 긴장감을 주고자 하는건 통한것 같다. 나는 시도와 의도를 좋게 봐... 
448,부산행,2016,"액션, 스릴러",8, 관람객 좀비들의 독특한 움직임과 중간 중간 나오는 특색있는 연출이 한국 좀비영화의 시작을 유쾌하게 열었다고 생각합니다. 
449,부산행,2016,"액션, 스릴러",9, 관람객 한국 좀비영화로서 웰메이드이다 
450,부산행,2016,"액션, 스릴러",9, 관람객 부산행 한국에서 만들지 않은 장르의 영화입니다새롭네요 
451,부산행,2016,"액션, 스릴러",10, 관람객 기차라는 특유한 공간을 이용햇단 점에서 신선하게본 좀비영화임 
452,부산행,2016,"액션, 스릴러",10, 관람객 재밋엇어용 ㅎㅎㅎ 신선한 좀비와의 결투 
453,부산행,2016,"액션, 스릴러",10, 관람객 별점 10점만점에 10점 
454,부산행,2016,"액션, 스릴러",10, 관람객 진짜 재밋엇어용 짱짱~!! 
455,부산행,2016,"액션, 스릴러",10, 관람객 감동도있고 재밌었다 좀비가 그럴듯하다 
456,부산행,2016,"액션, 스릴러",10, 관람객 좀비물 오랜만에 봤는데 넘 재밌게 잘봤어요 
457,부산행,2016,"액션, 스릴러",10, 관람객 좀비가 무서운게아니라 사람이무섭다는걸 알려주는영화 
458,부산행,2016,"액션, 스릴러",8, 관람객 한국에서 이정도 퀄리티의 좀비영화라면 지극히 한국스러움도 충분히 눈감아줄수 있다. 
459,부산행,2016,"액션, 스릴러",8, 관람객 마지막 신파만 빼면 좀비들때문에 쫄깃 
460,부산행,2016,"액션, 스릴러",10, 관람객 재밌어요 ㅎㅎㅎㅎ 꼭 보세요 
461,부산행,2016,"액션, 스릴러",7, 관람객 한국좀비물의 괜찮은 시작 
462,부산행,2016,"액션, 스릴러",9, 관람객 스릴잇엇어요.ㅡ감동도잇구요 
463,부산행,2016,"액션, 스릴러",10, 관람객 좋아요굿굿굿굿뷁부ㅐㅎㅅ 
464,부산행,2016,"액션, 스릴러",9, 관람객 좀잔인했지만 재밋엇어용ㅎㅎ 
465,부산행,2016,"액션, 스릴러",10, 관람객 부산행 정말 재미잇구뇽 
466,부산행,2016,"액션, 스릴러",10, 관람객 재밌었어요~~~~^^ 
467,부산행,2016,"액션, 스릴러",10, 관람객 재미있게 잘 봤습니다. 
468,부산행,2016,"액션, 스릴러",10, 관람객 재미있게 잘봤네요~~ 
469,부산행,2016,"액션, 스릴러",9, 관람객 두번봤어요ㅎㅎ 생각보다 너무 재밌었어요! 
470,부산행,2016,"액션, 스릴러",10, 관람객 아주재밌게 보고왔습니다! 
471,부산행,2016,"액션, 스릴러",10, 관람객 나이스재미이이어어요 
472,부산행,2016,"액션, 스릴러",10, 관람객 공유진짜개쩜ㅠㅠ좀비여도머시썽ㅠㅠ 
473,부산행,2016,"액션, 스릴러",8, 관람객 마동석의 원맨쇼!!! 
474,부산행,2016,"액션, 스릴러",10, 관람객 엄마랑 같이 봤는데 재밌었어요~ 
475,부산행,2016,"액션, 스릴러",9, 관람객 우리나라도 좀비영화를 이렇게 만들수 있다니 
476,부산행,2016,"액션, 스릴러",10, 관람객 너무 감동적이면사 마지막은 슬퍼서 펑펑 
477,부산행,2016,"액션, 스릴러",10, 관람객 내용도 좋고 감동도 있었다. 
478,부산행,2016,"액션, 스릴러",9, 관람객 부산행이 첫 좀비물이였던 나에게 좀비라는 매개체는 넘나 신선한 충격이였던것. 다양한 시각으로 한번 더 보고싶은 영화. 
479,부산행,2016,"액션, 스릴러",10, 관람객 완전잼나든데요마지막에슬퍼요ㅜㅜ잉간만에좋은영화본듯요 
480,부산행,2016,"액션, 스릴러",10, 관람객 재밋다 재밋어 추천합니다 
481,부산행,2016,"액션, 스릴러",10, 관람객 재밌네 완벽한 좀비 한국형 
482,부산행,2016,"액션, 스릴러",10, 관람객 우리나라에서 만든 좀비영화 생각보다 너무 잘만들어진듯하다 
483,부산행,2016,"액션, 스릴러",10, 관람객 정말 정말 시간가는줄 몰랐어요. 최고입니당 몰입도!! 
484,부산행,2016,"액션, 스릴러",10, 관람객 가족들과 재밌게 봤습니다 감사합니다 
485,부산행,2016,"액션, 스릴러",10, 관람객 마동석 너무 멋있음 공유랑 너무 잘어우림 최고 
486,부산행,2016,"액션, 스릴러",5, 관람객 유치하고 별로 였음..내용도 연기도.. 
487,부산행,2016,"액션, 스릴러",7, 관람객 누가 들어갈땐 '와!한국에도 이런영화가'하고 나올땐 '한국영화답네'이런다 했는데 맞는말인듯 
488,부산행,2016,"액션, 스릴러",4, 관람객 공유의 분유광고는 좀 빼지... 
489,부산행,2016,"액션, 스릴러",10, 관람객 공유는 좀비로 변해도 멋있네~ㅋㅋ 
490,부산행,2016,"액션, 스릴러",8, 관람객 아버지를 다시한번 사랑하게 된 영화 
491,부산행,2016,"액션, 스릴러",8, 관람객 한국스러움을 잘 녹여낸 좀비물 
492,부산행,2016,"액션, 스릴러",10, 관람객 우리나라에서는 최초의 좀비영화라는데 첫시도에비해 좀비들의 표현이 너무 뛰어났고 배우들의 연기력 또한 너무 좋았습니다~ 
493,부산행,2016,"액션, 스릴러",9, 관람객 지루한게 없이 잼나게 잘봤어요 굿 
494,부산행,2016,"액션, 스릴러",8, 관람객 공유는 친자 확인 하기바람 
495,부산행,2016,"액션, 스릴러",10, 관람객 재밌게봤습니다. ~~~~ 
496,부산행,2016,"액션, 스릴러",8, 관람객 재밌고 볼만했다..예상이 되는 감동.. 
497,부산행,2016,"액션, 스릴러",9, 관람객 한국에서 만든 좀비물인데 상당히 자연스럽고 좋았어요 촬영기법도 독특했구요 재밌게 관람했습니다~~ 
498,부산행,2016,"액션, 스릴러",9, 관람객 좀비영화 잘 만들었네~~~ 
499,부산행,2016,"액션, 스릴러",10, 관람객 잠자느라 예약해놓고 못봄ㅋㅋ 
500,부산행,2016,"액션, 스릴러",10, 관람객 완전 슬퍼서 눈물이..ㅜ 
501,부산행,2016,"액션, 스릴러",8, 관람객 외국좀비랑 비교해도 손색없을 정도! 우리나라 영화의 발전에 엄지척 
502,부산행,2016,"액션, 스릴러",9, 관람객 배우는 창작자 입장에서 평가합니다... 좀비영화가 아니라 정치 영화군요... 매우 공감했습니다.. 잘 봤습니다. 착한 결말이 아니라 열린 결말이었어도 멋졌을 것 같다는 생각에 9점 올립니다. 여름날.. 서슬퍼렇지만 ... 
503,부산행,2016,"액션, 스릴러",9," 관람객 인간의 추악함, 가족애, 극한상황에서의 이기주의.모든게 다나옴잼있네요^^ "
504,부산행,2016,"액션, 스릴러",8, 관람객 스토리는 좋어요근데 아역배우의 연기가 내용의 흐름을 끈게만드네요 
505,부산행,2016,"액션, 스릴러",10, 관람객 굿굿아주재밋어요~~~ 
506,부산행,2016,"액션, 스릴러",9, 관람객 국가적 재난 이나 어떠한 상황이든지 좀비보다 사람의 본성이 더 무섭다는 걸 알게 해주는 영화 
507,부산행,2016,"액션, 스릴러",10, 관람객 두말하면 입아프고 손아픔!흥행하는영화는 다 이유가있죠절대 돈아깝지않은 영화!! 
508,부산행,2016,"액션, 스릴러",10, 관람객 재밌고 좋았어요~~!! 
509,부산행,2016,"액션, 스릴러",8, 관람객 바이러스 원인이 불확실... 
510,부산행,2016,"액션, 스릴러",9, 관람객 한국 좀비영화라 기대감 없이 봤는데 기대이상이였습니다. 모든 배우들 다 좋았으나 마동석 배우가 제일 기억에 남는! 
511,부산행,2016,"액션, 스릴러",10, 관람객 마동석 멋있다!! 영화괜찮네!! 
512,부산행,2016,"액션, 스릴러",8, 관람객 스릴 만점 넘 재미있게 봤어요 
513,부산행,2016,"액션, 스릴러",8, 관람객 재밌어요 스릴있고 긴장감있음 
514,부산행,2016,"액션, 스릴러",10," 관람객 재미있었고, 심금을 울리네요! "
515,부산행,2016,"액션, 스릴러",10, 관람객 마지막까지 긴장감을 못놓게 만드는 ㅠㅠㅜㅜ스포당하고봐도 재밌는 영화는 처음입니다 짱 
516,부산행,2016,"액션, 스릴러",10, 관람객 호러일줄이야..ㅎㄷㄷ 
517,부산행,2016,"액션, 스릴러",9, 관람객 왜 사람들이 부산행 부산행 하는지 알겠음 엄마랑 재밌게 잘봤어요 
518,부산행,2016,"액션, 스릴러",10, 관람객 공유 넘 멋짐~~~아역연기도굿 
519,부산행,2016,"액션, 스릴러",9," 관람객 좀비물인데, 가장 지배적인 감정은 슬픔..이네요. 스토리를 알고 갔음에도 재미있게 봤어요. "
520,부산행,2016,"액션, 스릴러",10, 관람객 좀비 ㅋㅋㅋ 가족영화로는 볼만함 
521,부산행,2016,"액션, 스릴러",6, 관람객 재미있게 볼수있는 영화네요~ 가족의 소중함과 사랑을 영화속에 잘 표현함요~ 
522,부산행,2016,"액션, 스릴러",7, 관람객 억지 눈물 좀 짜증납니다내용과 효과적면에는 국내에서 만든 영화치곤 괜찮음 
523,부산행,2016,"액션, 스릴러",10, 관람객 공유 지리구요 마동석 오지구요 
524,부산행,2016,"액션, 스릴러",10, 관람객 배우들 연기도 좋고 특히 좀비들 뛰어댕기는게 ㅎㄷㄷ 
525,부산행,2016,"액션, 스릴러",5, 관람객 한국 좀비물치고 그냥 볼만했던 영화 
526,부산행,2016,"액션, 스릴러",10, 관람객 한국에 이런 좀비물이 나올지 몰랐네요기대만큼 재미있게 보고왔습니다 지금 700만 찍었다는데 역대급관객 정점 찍었으면 좋겠습니다부산행 파이팅! 정유미누나 사랑합니다^^♡ 
527,부산행,2016,"액션, 스릴러",10, 관람객 난.너무재미있어마동석진짜갑이다 
528,부산행,2016,"액션, 스릴러",9, 관람객 생각보다 재밌았습니다 
529,부산행,2016,"액션, 스릴러",10, 관람객 오오오오옹동석이형 멋이다 
530,부산행,2016,"액션, 스릴러",10, 관람객 뻔한좀비영화가아니어서 정말재미있게 보고왔습니다 
531,부산행,2016,"액션, 스릴러",10, 관람객 의미도있고 단순한 좀비물이 아닙니다.추천 
532,부산행,2016,"액션, 스릴러",7, 관람객 재미있게 봤지만 뭔가 찜찜한 느낌이 남는 영화. 작품성이나 감독의 의도는 생각하지 말고 그냥 좀비런과 다소 억지스런 세태풍자를 즐기면 좋을 듯. 
533,부산행,2016,"액션, 스릴러",6, 관람객 너무기대해서 그런지 허무 
534,부산행,2016,"액션, 스릴러",7, 관람객 내용없고 좀비만 나왔다가 사라진 느낌? 
535,부산행,2016,"액션, 스릴러",3, 관람객 개연성도 없고 무섭기만 하고ㅠㅠ 심리만 자극하는 영화ㅠㅠ 
536,부산행,2016,"액션, 스릴러",2, 관람객 1. 마동석 무쌍2. 안소희 전달력 없는 연기3. 김의성의 인간 본성 잘 드러낸 연기4.스토리 허접 
537,부산행,2016,"액션, 스릴러",4, 관람객 재미 없어요 좀비 영화 의 한계 가 느껴져요 
538,부산행,2016,"액션, 스릴러",5, 관람객 중간부터 영화를 본 찝찝함이 남네요아쉽습니다 
539,부산행,2016,"액션, 스릴러",10, 관람객 이건 좀비들 상 다줘야한다. 
540,부산행,2016,"액션, 스릴러",9, 관람객 너무박진감넘치고 재밌네요 
541,부산행,2016,"액션, 스릴러",10, 관람객 마동석 공유 딸 할머니 다멋지다 굿 
542,부산행,2016,"액션, 스릴러",8, 관람객 꿀잼~~~꼭 보세요ㅎㅎ 
543,부산행,2016,"액션, 스릴러",10, 관람객 재밌어용 부산행 짱짱짱 
544,부산행,2016,"액션, 스릴러",7, 관람객 쏘쏘였던 영화였다. 볼정도는 된다. 
545,부산행,2016,"액션, 스릴러",8, 관람객 재밌었어요~ 인간과 사회에 대해 고민할수 있는 철학적인부분도 있구요 
