,title,year,genre,score,review
0,부산행,2016,"액션, 스릴러",10, 관람객 그냥 한국형 좀비물이 어색하지 않았다는 거에 큰 점수를 주며 앞으로의 한국영화를 기대해봅니다. 
1,부산행,2016,"액션, 스릴러",10, 관람객 생각보다 너무 재밌었다 
2,부산행,2016,"액션, 스릴러",10, 관람객 마동석 진짜 웃겨요 사랑해요 
3,부산행,2016,"액션, 스릴러",9, 관람객 한국에서 볼 수 없었던 영화 
4,부산행,2016,"액션, 스릴러",5, 관람객 심은경 열연 감동했어요. 
5,부산행,2016,"액션, 스릴러",10, 관람객 재밌네요!추천!전 지루하지않고 재밌게 봣습니다 
6,부산행,2016,"액션, 스릴러",8, 관람객 재난영화에서 언제까지 여성은 연약하고 수동적이어야만 하나 
7,부산행,2016,"액션, 스릴러",8, 관람객 처음 좀비나왔을때는 유치할꺼라 생각했는데 보는내내 재밌고 시간가는줄 몰랐어요 
8,부산행,2016,"액션, 스릴러",5, 관람객 영화에 온전히 몰입하기엔 생각보다 연기력이 아쉬운 몇몇사람들.. 
9,부산행,2016,"액션, 스릴러",8, 관람객 좀비물인데 15세라 별거없겠지 하고 보러갔는데나름 위압감있는 좀비의 공세에 놀랐습니다.물론 장기파티도 안나오고 다소 진부한 전개와 한국전통의 가족애는 여전하지만 잘 뽑힌 좀비영화내요.그나저나 꼰대 한놈 때문에 몇명... 
10,부산행,2016,"액션, 스릴러",6, 관람객 초반엔 고속질주 후반엔 급브레이크 
11,부산행,2016,"액션, 스릴러",8, 관람객 이런류 영화 좋아요 아주아주 
12,부산행,2016,"액션, 스릴러",10, 관람객 다른사람들은 재미없다는데 난너무재밌음ㅋㅋ또보고싶다ㅋ 
13,부산행,2016,"액션, 스릴러",9, 관람객 영화 보는 내내 긴장의 끈을 놓을 수가 없었고.. 마지막엔 슬퍼서 눈물 쪼꼼 났어요..ㅜ 
14,부산행,2016,"액션, 스릴러",6, 관람객 아역배우랑 소희의 연기력이 아쉽네요.결말도 허무하구요. 
15,부산행,2016,"액션, 스릴러",5, 관람객 기대없이 봐서 재밌게 봤어요 영화내용이 이런 사건이 생긴 이유나 해결방법 등 전혀 없이 그냥 계속 쫓기고 죽다가 끝나서 조금 허무하긴 하지만 스릴넘치네요 
16,부산행,2016,"액션, 스릴러",1, 관람객 마지막 아이의 노래를 듣는순간 짜증나서 내가 좀비로 변할것 같았다 
17,부산행,2016,"액션, 스릴러",9, 관람객 원래 sf나 좀비 같은 실제하지않는 허구의 영화를 좋아해서 별점은 높다. 실제로 영화도 재밌다. 그러나 아쉬운건 영화 초반 감염경로나 마지막 결말부분이 너무 부족한게아닌가... 
18,부산행,2016,"액션, 스릴러",1, 관람객 꼭 조연들은 물리면 일초만에 좀비되고 주요인물들은 하루 죙일 감정잡다 적당한 타이밍에 변하냐? 그 외에도 좀비들이 달리는 기차에 뭉텅이로 매달리질 않나 갑자기 불타서 선로막는 기차에 코미디 수준 ㅋㅋ 
19,부산행,2016,"액션, 스릴러",2, 관람객 이건 마동석이 주인공이다 
20,부산행,2016,"액션, 스릴러",9, 관람객 좀비가 나오는 재난영화의 완성도가 이 정도까지라는 점이 굉장히 놀랍다. 재미있게 잘 봤다. 
21,부산행,2016,"액션, 스릴러",6, 관람객 후반부가 허무했어요. 
22,부산행,2016,"액션, 스릴러",8, 관람객 신파는 좀 뺐으면 합니다.. 
23,부산행,2016,"액션, 스릴러",3, 관람객 신파가 영화를 망쳤다. 공유의 분유광고는 덤. 
24,부산행,2016,"액션, 스릴러",7, 관람객 좀비가 한국에 오면 ㅈ되는거야 아주 ㅈ되는거지 
25,부산행,2016,"액션, 스릴러",6," 관람객 후반부 에 억지스러움 이 있었음 ,, "
26,부산행,2016,"액션, 스릴러",1, 관람객 [월드워Z]의 좀비와 발암선동질 [미스트]를 섞어논 짬뽕작.한국의 좀비라는 신선한?시도는 했지만 영화내용중 꼬마의 오지랖과 위기상황마다 멀뚱멀뚱 쳐다보는 장면이 1~2번 나오는것도 아닌 매순간마다 나옴. 이게 재... 
27,부산행,2016,"액션, 스릴러",1, 관람객 진짜 마동석말고는 하....스토리라는게 없고 허구한날 눈물찔찔하려고 만든영화 
28,부산행,2016,"액션, 스릴러",1, 관람객 왜 칸느에서 기립박수를쳤는지 전혀이해가 가지않는다 
29,부산행,2016,"액션, 스릴러",1, 관람객 그닥... 군바리들 불쌍해 ㅜ 군대가서 감염 당했는데 거따가 마동석을 뿌려? 
30,부산행,2016,"액션, 스릴러",1," 관람객 암걸리고 더러운인간성을 많이뿌려놓고 어느정도회수해야되는데,,,볼수록 기분안좋아집니다 , "
31,부산행,2016,"액션, 스릴러",10, 관람객 마동석의 우리딸 이름.. 가슴이 찡했다 
32,부산행,2016,"액션, 스릴러",1, 관람객 참 뭐라평을 해야할지 모르겠네요 그저 보는내내 답답했읍니다 
33,부산행,2016,"액션, 스릴러",1, 관람객 하하하하공유잘생겼다 
34,부산행,2016,"액션, 스릴러",7, 관람객 '쾌속의 감흥에서 신파의 터널로' 박평식 한 줄 평이 딱 맞는다. 잘 팔리게 만드느라 아쉬워진 영화. 
35,부산행,2016,"액션, 스릴러",2, 관람객 좀비영화 부산행은 처음시작할때 원인이 불명확한 바이러스가 확인 안된점과 급속도로 퍼지는 좀비들이 인간세상에 던진 이유가 없고. 좀비퇴치 결과가 너무 미흡해서 스릴도 약하고 코믹도 섞여 인기없다고봅니다. 
36,부산행,2016,"액션, 스릴러",7, 관람객 좀비만보다 끝 내용도없고 
37,부산행,2016,"액션, 스릴러",1, 관람객 9500이면 아프리카 많은 어린이들을 살릴 수 있습니다! 
38,부산행,2016,"액션, 스릴러",1, 관람객 일단 재미가없다. 개연성도없다. 연기를못하는 배우떄문에 몰입도도 떨어진다. 
39,부산행,2016,"액션, 스릴러",1, 관람객 별로... 억지스러움 모두 다... 
40,부산행,2016,"액션, 스릴러",9, 관람객 한국형 좀비물 가능성 있네요. 좀비 좋아하시는 분들께추천합니다. 
41,부산행,2016,"액션, 스릴러",1, 관람객 핵노잼 보는내내답답 몇몇발연기 엔딩...하.... 
42,부산행,2016,"액션, 스릴러",5, 관람객 여러 영화 짬뽕한거 같네요 
43,부산행,2016,"액션, 스릴러",1," 관람객 무엇을 표현하고자 하는지 모르겠음.감동도 없고 여운도 없고 뭔가 남는게 하나도 없음.아 남는게 있다면..공유의 비현실적인 잘생김과 마동석의 하드케리와 정유미의 미모?극장서 영화 끝난후 모든관객들이 잠적...""... "
44,부산행,2016,"액션, 스릴러",1, 관람객 잼없음 재미없음 난 서율행 
45,부산행,2016,"액션, 스릴러",8, 관람객 심은경 특별출연인데 강한 인상남기고감 소희는 나만 어색한가???? 악역이 연기를 너무 잘해서 보는내내 화나는 영화 
46,부산행,2016,"액션, 스릴러",2, 관람객 억지신파 전형적 옛날한국영화 
47,부산행,2016,"액션, 스릴러",1," 관람객 어마어마한 쓰레기 영화를 만들어놓음, 왜등장하는지 모르는 케릭터들 하며,, 개연성없는스토리하며... 결말도 ... "
48,부산행,2016,"액션, 스릴러",1, 관람객 감정팔이는 그만 화끈한 좀비영화좀 만들어봐라.. 
49,부산행,2016,"액션, 스릴러",1, 관람객 노잼..입니다. 낚이지 마세요 
50,부산행,2016,"액션, 스릴러",1, 관람객 진심한개도주기아깝다 진심으로하는얘기인데 영화 집중은되고 재미? 솔직히 조금있는데 까놓고말해서 속답답하다 영화보는 내내 답답해서미칠지경이다 감독 영화만드느라수고했는데 너무관객들을 답답하게만들었다 상황이한두가지도아니고 ... 
51,부산행,2016,"액션, 스릴러",1, 관람객 영화관에서 나가고 싶었음 
52,부산행,2016,"액션, 스릴러",1, 관람객 마동석형님때문에 재미는있으나 애기가 답답하고 짜증남 평소에는 문도 잘 닫더니 문 안닫아서 물리고 물리고 떠 물리고 어쩔땐 깨지는 문 어쩔땐 안깨지는 문 
53,부산행,2016,"액션, 스릴러",1, 관람객 이걸 돈주고 봤다니... 
54,부산행,2016,"액션, 스릴러",1, 관람객 별 하나도 아까운 b급 좀비 영화. 스토리 없음 그냥 좀비피해 도망다니다가 다 죽고 끝남 
55,부산행,2016,"액션, 스릴러",10, 관람객 그 아저씨 진짜 완전 아 짜증난다 
56,부산행,2016,"액션, 스릴러",1, 관람객 할거없어도 보지말도록하자 믿어라 
57,부산행,2016,"액션, 스릴러",7, 관람객 너무기대했나봄 생각보단그저그랬음 
58,부산행,2016,"액션, 스릴러",3, 관람객 연상호 감독님의 애니를보고 많이 기대했습니다. 실망수준이 아닙니다. 그냥 치고받는 좀비액션영화 
59,부산행,2016,"액션, 스릴러",1, 관람객 최악의 똥을 삼킨 기분더럽다 
60,부산행,2016,"액션, 스릴러",1, 관람객 국산 좀비는 아직인것 같다 
61,부산행,2016,"액션, 스릴러",1, 관람객 좋다는 사람들은 어디서 오신분들인지.. 
62,부산행,2016,"액션, 스릴러",1, 관람객 월드워z보세요...ㅠ 
63,부산행,2016,"액션, 스릴러",1, 관람객 내 생에 최악의 영화별점 1도 아깝다 소희의 웃픈연기는이지혜를 뛰어 넘었다 
64,부산행,2016,"액션, 스릴러",1," 관람객 아이돌 그룹을 보는 것 같음. 마동석은 액션담당, 공유는 여자몰이와 감성팔이 담당 등등.... 좀비영화에 애매한 감성은 필요가 없음을 입증하고 있는 영화. "
65,부산행,2016,"액션, 스릴러",1, 관람객 외국좀비물에비해너무하네요 
66,부산행,2016,"액션, 스릴러",1, 관람객 재미없음.... 
67,부산행,2016,"액션, 스릴러",1, 관람객 내인생최악의영화예요 
68,부산행,2016,"액션, 스릴러",9, 관람객 마동석하드캐리입니다다닫 
69,부산행,2016,"액션, 스릴러",3, 관람객 감명도 없고 결말도 없고 걍 슬프다... 
70,부산행,2016,"액션, 스릴러",1, 관람객 구체적인 좀비 생성 과정이런것은 기대안함. 좀비 분장도 훌륭하고 연기도 탁월했습니다. 하지만 왜 굳이 어째서리 다된 좀비물에 한국 영화 특유의 후반부 억지 감동 팍팍 투입?? 
71,부산행,2016,"액션, 스릴러",8, 관람객 역시 우리 마블리♥ 좀비 때려잡는데 박력이 장난아님 
72,부산행,2016,"액션, 스릴러",1, 관람객 최근 본 영화중 가장 이상했던 영화 
73,부산행,2016,"액션, 스릴러",1, 관람객 영화평점 처음쓰는데 ...보는데 암걸이겠다 스토리도짜증 연기도 짜증 좀비하고 술래잡기하는것도아이고 .. 참내 ... 
74,부산행,2016,"액션, 스릴러",3, 관람객 뭔가 부족한느낌 그냥그럼 
75,부산행,2016,"액션, 스릴러",1, 관람객 별로... 취향에안맞아서그런지.. 
76,부산행,2016,"액션, 스릴러",1, 관람객 올해 본 영화중에서 역대급 최악이었어요 개연성도 없고 어디서부터 바이러스가 시작된건지에대한 내용은 1도없고크으아아악 이렇게 시작해서 크으아아악 이렇게 끝나는영화에요 최악입니다 
77,부산행,2016,"액션, 스릴러",4, 관람객 그냥 그닥.. 너무 눈물짜내려고하는듯.. 
78,부산행,2016,"액션, 스릴러",1, 관람객 믄데 끼아아아악악악꾸에에엑엑엑 
79,부산행,2016,"액션, 스릴러",1, 관람객 홍보가과한듯합니다 몰입도가죽여준다더니 ㅋㅋㅋ 몰입도안되고...좀비영화아직은아닌가봅니다 
80,부산행,2016,"액션, 스릴러",1, 관람객 내인생 최고의 쓰레기영화 
81,부산행,2016,"액션, 스릴러",1, 관람객 재밌다고해서 봤는데 전 내내 지루했어요. 처음에 너무 지루해서 나갈까 했는데 시작한지 겨우 30분정도- 그냥 좀비설명영화 같았어요. 좀비는 이런 특징이 있다 - 하고 설명해주는. 아무튼 별로였습니다 
82,부산행,2016,"액션, 스릴러",1, 관람객 뜯어 먹고 열차객실 문 닫는 장면밖에 없네요...좀비출현 원인과 소탕방법도 없고...잔인한 실망 
83,부산행,2016,"액션, 스릴러",10, 관람객 공유가애기처럼 우는데도 잘생겼더라ㅠ 
84,부산행,2016,"액션, 스릴러",1, 관람객 보는 내내 짜증. 싸구려 감동이나 자아냄. 외국 영화 짜깁기. 후반 기차에 좀비 달고가는 씬에는 마네킹다리 다 보임. 내 돈주고 보기 아까운 영화. 결말도 <미스트>처럼 공허하면 나은데 이건 엔딩크레딧에 ... 
85,부산행,2016,"액션, 스릴러",1, 관람객 영화 구성이 엉망입니다 
86,부산행,2016,"액션, 스릴러",1, 관람객 내가 이 영화 천만에 기여했다니...극 중 다급한 사람은 아무도 없다. 굳이 안들어가도 되는게 너무너무 많아서 영화가 산으로 간다.다른 사람들이 놀라고 눈물 흘릴때 그냥 미간만 찌푸려졌다. 
87,부산행,2016,"액션, 스릴러",1, 관람객 좀비도 사람도 안무섭습니다. 네이버 평점이 무섭습니다. 
88,부산행,2016,"액션, 스릴러",9, 관람객 기차라는 소재 신의한수 ㄷㄷ긴장감 최고 
89,부산행,2016,"액션, 스릴러",1, 관람객 그닥 별루 답답한 영화였음 
90,부산행,2016,"액션, 스릴러",1, 관람객 내용이너무빈약한듯 합니다. 
91,부산행,2016,"액션, 스릴러",1, 관람객 진짜 월드워z 따라만드느나 수고했다 기왕이면 좀비탑도 만들지 그랬냐 
92,부산행,2016,"액션, 스릴러",1, 관람객 칵!!!카악 캌!!! 
93,부산행,2016,"액션, 스릴러",1, 관람객 한국 최초 좀비영화에 박평식이 7점 줬다해서 보러갔는데 아주 가관이여.... 
94,부산행,2016,"액션, 스릴러",1, 관람객 아무리 영화라지만 좀비들이 기차 물고늘어지는 장면은 너무아니드라 ㅡㅡ 
95,부산행,2016,"액션, 스릴러",10, 관람객 동양좀비 웃길 줄 알았는데 진짜 소름끼쳤고 잘만들었다. 계속 깜짝깜짝 놀라서 심장 내려앉을뻔...ㅠ 
96,부산행,2016,"액션, 스릴러",7, 관람객 작년에 개봉한 외국 좀비영화보다 낫다 좀비 나오는 영화가 쫓고 쫒기고 하다가 끝나는것 큰 기대는 하지 말길 바랍니다 
97,부산행,2016,"액션, 스릴러",5, 관람객 외국좀비영화와 견주어봐도 손색없을 정도로 좀비에 대해서는잘표현한것같아요! 근데 스토리는 한국영화에서 흔히볼수있는 스토리라 많이 진부하고 뻔한감성유발같았어요ㅠㅠ 
98,부산행,2016,"액션, 스릴러",6, 관람객 개연성이 부족하고 원인을 몰라 아쉽다 
99,부산행,2016,"액션, 스릴러",1, 관람객 나만 볼수없지 ㅋㅋㅋㅡㅡ 
100,부산행,2016,"액션, 스릴러",1, 관람객 좀비영화에용~이건머 스토리도없꼬 감동도없고 걍 헛웃음만 나오네요끝나고나니 걍 좀비 흉내나 내고 다니네요~^^ 
101,부산행,2016,"액션, 스릴러",1, 관람객 공유 수트핏에 일점. 나머지는 한국식 신파 중에서도 가장 급 낮은 신파 구조.... 실소를 많이 하게 되는 영화 
102,부산행,2016,"액션, 스릴러",1, 관람객 핵노잼 진심 왜 이딴식으로 영화를 만드는지 모르겠음 
103,부산행,2016,"액션, 스릴러",10, 관람객 현실적인 프레임에 호러 개그 액션 감동을 토핑한 스토리. 그러나 우발적인 행동들에 대해서는 마냥 공감할 수는 없는 영화. 
104,부산행,2016,"액션, 스릴러",1, 관람객 '아 저쯤되면 저런일이 일어나고 저사람이 죽겠구나'건국대 롯데시내마에 ..최악입니다 시작할때 앞에 문도 안닫고 중간에 관람객이 직접 문닫으러 가고 2시간동안 에어컨은 가동도하지않는지 땀이 너무많이나서... 
105,부산행,2016,"액션, 스릴러",1, 관람객 한국형 신파좀비물 억지전개 
106,부산행,2016,"액션, 스릴러",10, 관람객 초반에는 좀비가 나중에는 사람이 무서웠던 영화ㅎ 진짜 재미있었어요!! 
107,부산행,2016,"액션, 스릴러",10, 관람객 마동석님의 연기력 지리규! 
108,부산행,2016,"액션, 스릴러",1, 관람객 좀비연출좋습니다. 마동석 굳. 그러나 전체적인 인물성격이 너무억지스러워서 전혀 몰입이안됩니다. 영화도중에 황당해서 헛웃음소리가 계속들리더군요. 절대 천만급은 아니라고생각됩니다. 알바들인지뭔지 적당히쓰세요. 다크나이트... 
109,부산행,2016,"액션, 스릴러",1, 관람객 영화가 스토리도 약하고 억지스럽네요 돈주고 보기에 아깝고 보고나서도 찝찝한영화이런영화를 만드려고 투자한돈이 아깝게 느껴지네요 
110,부산행,2016,"액션, 스릴러",1, 관람객 비추 너무스토리 별르임 
111,부산행,2016,"액션, 스릴러",3, 관람객 진짜별로 감정을쥐어짜낼려고하네 
112,부산행,2016,"액션, 스릴러",9," 관람객 재밌게 봄, 집갈때 자꾸 뒤돌아보게 됨 아역 연기때메 마지막에 너무 뭉클 하지만 다 된 밥에 소희 뿌리기ㅋ..발연기;;집중해서 보다 소희 나올때마다 팍 깸 "
113,부산행,2016,"액션, 스릴러",1, 관람객 절대로 보지마시길이건 영화 아닙니다. 
114,부산행,2016,"액션, 스릴러",1, 관람객 억지감동... 돈날림 
115,부산행,2016,"액션, 스릴러",1, 관람객 영화 망작 진짜 보다가 스트레스 받았네요 돈 아까움 
116,부산행,2016,"액션, 스릴러",10, 관람객 두시간동안 어깨를 못피구 봐서 담걸릴듯~^^우리나라 영화 진짜 좋아졌네요~~엔딩두 살짝은 뻔하지만 좀비물보구 이렇게 엉엉 울줄이야~~~완전 스릴만점~~감동 백배!!! 강추합니다 
117,부산행,2016,"액션, 스릴러",8, 관람객 마동석밖에 안보입니당ㅋㅋ 
118,부산행,2016,"액션, 스릴러",1, 관람객 진부하고 엉성함. 흥행의 이유가 파악되지 않음. 
119,부산행,2016,"액션, 스릴러",1, 관람객 영화 내내 빨리 끝나라는 생각 뿐이었음. 억지 전개에 내용도 전혀 없고 오로지 좀비들과 숨바꼭질 놀이뿐... 
120,부산행,2016,"액션, 스릴러",1, 관람객 하스포당하고보니개열받노잼 
121,부산행,2016,"액션, 스릴러",5, 관람객 부족하고 부족하다 공유와의 의리로 봤다 
122,부산행,2016,"액션, 스릴러",10, 관람객 인간의 본성을 보여준 재밌는 영화 
123,부산행,2016,"액션, 스릴러",1, 관람객 럭키짱급 영화 1점도 아깝다 
124,부산행,2016,"액션, 스릴러",1, 관람객 재난영화에 어울리지않는 사람이 몇몇보임.. 좀비영화라기보단 한국 정통적인 막장스토리에 좀비를 끼얹음 
125,부산행,2016,"액션, 스릴러",1, 관람객 좀비만 득실거리네요ㅠㅠ 
126,부산행,2016,"액션, 스릴러",3, 관람객 너무기대를했나요.. 별로.. 
127,부산행,2016,"액션, 스릴러",1, 관람객 별로 네요 연기는 잘 하셨으나 연출능력과 영화전체적으로 완성도가 떨어지고 촌스러워요 헐리웃영화 좀 보고 만드시길... 
128,부산행,2016,"액션, 스릴러",5, 관람객 티비에 영화뜨면 티비로 사서 보세요. 오만 때만 스토리 다집어 넣고 영화망친케이스. 
129,부산행,2016,"액션, 스릴러",9, 관람객 한국 좀비영화의.. 시작을 알리다! 
130,부산행,2016,"액션, 스릴러",1, 관람객 월드워z 쌈마이판 너무 어설퍼서 웃길정도이다. 
131,부산행,2016,"액션, 스릴러",1, 관람객 아무런 내용도 없는 그저 좀비영화 
132,부산행,2016,"액션, 스릴러",1, 관람객 아 나는 정말 재미가없다 
133,부산행,2016,"액션, 스릴러",4, 관람객 재밋는지 잘모르겟어요 
134,부산행,2016,"액션, 스릴러",10, 관람객 마동석이 중간중간 터져주네요 
135,부산행,2016,"액션, 스릴러",8, 관람객 내가 할머니여도 열차문을 열었을것같다 
136,부산행,2016,"액션, 스릴러",2, 관람객 좀비영화 팬으로써 정말 최악이였습니다 할머니가 좀비로됬는데 무섭기보단 국밥한그릇 사주실거같은느낌...어떻게 좀비가 퍼졌는지 마지막 부산은 어떻게되가고있는지 이런거를 보여주지않았네요 그냥 애기가 질질짜면서 노래하다가 ... 
137,부산행,2016,"액션, 스릴러",1, 관람객 마지막 여자애 노래에서 클래식 명작 클레멘타인이 오버랩됬다. 11점 주고 싶은 나의 마음이다. 
138,부산행,2016,"액션, 스릴러",1, 관람객 억지스런 스토리 매끄럽지않은 흐름지루했음 
139,부산행,2016,"액션, 스릴러",1, 관람객 솔직히 영화관에서 웃음 참느라 힘들었습니다. 궁금하시면 한번 보시길.. ^^ 
140,부산행,2016,"액션, 스릴러",1, 관람객 평점 높아서 봤더니 정말 재미없었습니다. 
141,부산행,2016,"액션, 스릴러",10, 관람객 보는내내 어떻게어떻게 빨리문닫아 이소리가 입밖으로 튀나온다 영화끝난후엔 .. 괜히좀비소리가 귀에맴돌고....마동석 진짜 귀여우시다짱멋쟁이 공유는 ..ㅠㅠ 눙물 진짜 재밌다 짱 ! 
142,부산행,2016,"액션, 스릴러",1, 관람객 그냥 3류재난영화? 허무합니다 
143,부산행,2016,"액션, 스릴러",1, 관람객 최악...비현실적인 주제에 배경음악은 고막이 터지는 느낌에 돈이 아깝다는 생각뿐이다. 
144,부산행,2016,"액션, 스릴러",1, 관람객 스토리가 너무하다 ㅋㅋㅋㅋ 
145,부산행,2016,"액션, 스릴러",1, 관람객 이게왜 천만이지 이해가안되네 
146,부산행,2016,"액션, 스릴러",1, 관람객 진짜 대진운이 좋았네ㅠ 
147,부산행,2016,"액션, 스릴러",1, 관람객 생각보다 별로예요 비추 
148,부산행,2016,"액션, 스릴러",1," 관람객 최악 진짜 돈,시간이 아까운 영화 "
149,부산행,2016,"액션, 스릴러",1, 관람객 개인적인 의견 별 반개 더이상 설명은 생략요 
150,부산행,2016,"액션, 스릴러",5, 관람객 억지 울음 유발 극혐입니다 
151,부산행,2016,"액션, 스릴러",1, 관람객 이게뭥미?왜천만인가요? 
152,부산행,2016,"액션, 스릴러",1, 관람객 최단기간 500만을 기록할정도로 명작인가? 
153,부산행,2016,"액션, 스릴러",8, 관람객 그래픽 기술 대박~실감나고 심장이 쫄깃~~간만에 재미난 영화 봤어요~ 
154,부산행,2016,"액션, 스릴러",1, 관람객 역시한국영화 하 연기력은 좋으나 쓸때없는 감정팔이재난영화 정신없이뛰어만다님 
155,부산행,2016,"액션, 스릴러",1, 관람객 이런거도영화라꼬합니까 
156,부산행,2016,"액션, 스릴러",1, 관람객 보지마보지마보지마보지마 
157,부산행,2016,"액션, 스릴러",1, 관람객 보고나서 기분이 되게 찝찝하게 만드는영화인듯 
158,부산행,2016,"액션, 스릴러",1, 관람객 기대를 많이해서 그런가 좀 별루... 
159,부산행,2016,"액션, 스릴러",1, 관람객 영화가 끝나고 무엇을 본지 기억이안남 
160,부산행,2016,"액션, 스릴러",10," 관람객 저는 유료시사회로 봤는데요. 영화프로그램에서 하이라이트 보고 예상 외로 재밌을 것 같아 보러 간 건데 기대 훨~훨~ 이상이었습니다. 끔찍한 거 못 보는데 좀비도 끔찍하지 않고 가끔은 귀여(^^;)웠고, 속도감, 감동... "
161,부산행,2016,"액션, 스릴러",1, 관람객 날더운데 이거보고 혈압오르지말입니다이거 볼 돈으로 시원한 아이스커피드세요그게 남는거같네요 
162,부산행,2016,"액션, 스릴러",1, 관람객 보지마세요 실망 노잼.이에요 
163,부산행,2016,"액션, 스릴러",1, 관람객 정말 신파극 재미없다 정말 
164,부산행,2016,"액션, 스릴러",1, 관람객 개노잼진짜재미없어요 괜히봣서요 
165,부산행,2016,"액션, 스릴러",1, 관람객 개 쓰레기 이딴걸 영화라고 
166,부산행,2016,"액션, 스릴러",10, 관람객 재밌고 무섭고 슬프다. 생각보다 뻔한 결말은 아니어서 좋았다. 
167,부산행,2016,"액션, 스릴러",10, 관람객 좀비시퀀스로 젊은층 잡고 스토리텔링으로 장년층 잡아먹는 정말 좀비같은 영화! 보는내내 지루한 시간은 처음 투자자 자막 올라오는 1분 뿐이다!!! 
168,부산행,2016,"액션, 스릴러",6, 관람객 그저그래요. 볼만은 함. 
169,부산행,2016,"액션, 스릴러",1, 관람객 예매하고 멍청하게 잠들어서 못봤다 
170,부산행,2016,"액션, 스릴러",9, 관람객 내용은 재밋었는데 원인이라던가 머 부가적인 설명이 빠져있어서 조금 아쉬웠습니다ㅠㅠ 
171,부산행,2016,"액션, 스릴러",10, 관람객 스포당해서 짜증났었는데 그래도 재밌었음 전혀 돈아깝지 않다 
172,부산행,2016,"액션, 스릴러",9, 관람객 미드에길들여진 사람으로써 큰기대없이봤는데 기대를좀하고보셔도 될듯합니다.무리하게 사람관계를집어넣으려고한건 쫌 오바스럽긴하지만... 
173,부산행,2016,"액션, 스릴러",10, 관람객 스포되기 전 본 영화라 다행ㅎㅎ 캐미가 있는 영화!! 
