,title,year,genre,score,review
0,써니,2011,"코미디, 드라마",7, 이 영화의 최대 단점은 마지막 돈으로 해결되는 부분들 
1,써니,2011,"코미디, 드라마",10," 난 70,80시대에 학창시절을 겪지않고 2000년대에 학창시절을 보냈다. 하지만 써니라는 영화는 시대를 떠나 나를 비롯해 많은사람들의 공감을 이뤄냈을거라 생각한다. 영화보는 내내 소름돋았다. 아름다운영화다 이것이 영... "
2,써니,2011,"코미디, 드라마",10, 역쉬 인생에 진정한친구는 중.고등학생때 친구지 
3,써니,2011,"코미디, 드라마",7, 과거 회상 장면은 나도 모르게 눈물이. 젊은 날의 회고록. 
4,써니,2011,"코미디, 드라마",10, 결말을 이해못하신건가? 수지랑 재회하면서 끝난 마지막장면은 열린결말로 정말 깔끔하고 완성도도 높다. 아직 어리다면 웬 욕만 많이하다 끝나나 하겠지만 우정이라는 큰 타이틀 속에 적절히 그 시대를 유머스럽게 풍자한 연출... 
5,써니,2011,"코미디, 드라마",8, 마지막 돈으로 해결하는것에 아쉬운 결말이라는 의견이 많은데.. 남은친구들을 위한 친구로써 할수 있는 도리를 다한것 아닌가란 생각이드네요.. 물질적이기 보다 의미에 의의를 둔다면 아주 아쉽지만은 않은 결말같습니다.. 
6,써니,2011,"코미디, 드라마",10, 이건 영화 친구와는 또다른 친구의 우정을 생각하게하는 영화입니다. 
7,써니,2011,"코미디, 드라마",10, 다섯번째봤지만 여전히재미있다 
8,써니,2011,"코미디, 드라마",9, 민효린 진짜 이쁘네. 
9,써니,2011,"코미디, 드라마",10, 진심으로 이 영화를 20번 가까이 봤어요...그런데 전 이영화가 싫어요...이 영화를 보고 자꾸 옛 향수에 빠져서 견딜 수가 없어요....근데 지금 또 보고 있어요..80년대 그때가 그리워요..너무 그리워요 
10,써니,2011,"코미디, 드라마",10," 난 한국영화는 거기서거기 라고 생각했다.써니는 달랐다. 이런 한국영화가 있다니 신기하고 감사하다. 분위기가 정말 훈훈하고 예쁘다, 작품성이 있고 특히 어른나미와 어린나미가 만나 끌어안는 장면을 보며 참 좋은 설... "
11,써니,2011,"코미디, 드라마",10, 현재랑 과거랑 오버랩시키는 타이밍이랑 촬영 아이디어가 너무좋아서 부드럽게 봣어요 ㅠ 
12,써니,2011,"코미디, 드라마",8, 재미있게 봤다. 마지막 춤추는 장면은 웃기지가 않고 감동스럽더라... 
13,써니,2011,"코미디, 드라마",7, 배우들의 연기가 뛰어나다. 삶이나 우정에대해 좀 더 생각하게 해준다. 뒷맛은 다소 씁쓸.. 
14,써니,2011,"코미디, 드라마",9, 민효린 얼굴다칠때 옆커플 여자가 소리질러내서 나혼자 영화보러간 내모습이 너무슬퍼보여서 1점깎는다 
15,써니,2011,"코미디, 드라마",10, 사랑은 변할지라도 친구와의 우정은 변하지 않는다.잊지 못할 영화였어요. :) 
16,써니,2011,"코미디, 드라마",10, 본드걸 천우희연기 ㅎㄷㄷ심은경 강소라 쩌리됨ㅋㅋㅋ 
17,써니,2011,"코미디, 드라마",10," 처음 볼 땐 기냥 재밌었는데 두번, 세번 보다보니까 뭔가 아련하고 좀 슬픈 것 같아요. 강소라씨 이런 캐릭터 너무 매력있는데 요즘엔 너무 여성스러운 캐릭터같아서 좀 아쉬움...요런 박력넘치는 캐릭터로 다시 만나고 ... "
18,써니,2011,"코미디, 드라마",7, 아쉽습니다 감독판으로 보는내내 좋았지만 아쉬운건 수지이야기가 너무 적다는것 그리고 춘화와 친했던 본드흡입하는 애의 과거이야기나?폭동이나 선생이 학생들을 패는장면 전에 비하인드 스토리가 있으면 어떨까 전체적인 틀은 잘... 
19,써니,2011,"코미디, 드라마",10, 명작 
20,써니,2011,"코미디, 드라마",10, 진짜 너무너무 재밌었음. 영화도 재밌었고 음악들도 신났고~ 
21,써니,2011,"코미디, 드라마",10," 보면서 웃고 울었다. 저 시대를 살아온 엄마도, 딸인 나도. "
22,써니,2011,"코미디, 드라마",8, 너무 재밌게 봤지만 마지막 유산 분배가... 
23,써니,2011,"코미디, 드라마",10, 나도 이런친구 있었으면 좋겠다 
24,써니,2011,"코미디, 드라마",10, 나 이거 8번봄 
25,써니,2011,"코미디, 드라마",10, 영화정말 잘 만들어 부렀어 특히 리얼리티 노래 ㅋㅋㅋㅋ 
26,써니,2011,"코미디, 드라마",10, 개잼슴bb 
27,써니,2011,"코미디, 드라마",10, 엄마가 된 지금.. 친구들과의 추억을 곱씹으며 다시 여고생이 된 기분이 드는.영화..그리고 나이 드신 엄마를 생각하면 더더욱 눈물나는 영화.. 
28,써니,2011,"코미디, 드라마",10, 몇번을 봐도 질리지 않는 영화. 
29,써니,2011,"코미디, 드라마",8, 너무 감동이에요 눈물은 안나지만옛날 시대 배경을 잘표현한것 같아요아역들과 성인배우들과 싱크로율도 좋아서몰입하기도 좋네요 그리고 확실히 19금판이랑 15금이랑 차이가 있네요 아무튼 좋앗어요 
30,써니,2011,"코미디, 드라마",10, 이런게 영화다 쩔어 쩔어 
31,써니,2011,"코미디, 드라마",10," 금전적인 부분이 별로라고 하는 사람들이 있는데 뭐 그런게 중요한가? 잘 산다고 쌩까면 응징하고, 못 사는 애 있으면 잘 살때까지 못살게 굴거라고 약속한게 중요하지. 그냥 의리라고 생각하면 되는 것 같슴다. ㅎㅎ "
32,써니,2011,"코미디, 드라마",10, 이젠 Sunny 노래만 들어도 저절로 떠오르게 되는 영화 '써니' 그리고 영화 속의 장면들친구들이 보고싶어지고 또 한편으로 아련해지게 만드는 영화 
33,써니,2011,"코미디, 드라마",10, 저도 지금 중ㅇ학생인데 이런 추억 꼭 만들고 싶어요ㅠㅠ 
34,써니,2011,"코미디, 드라마",10, 천우희가 갑임 본드연기 개쩔었슴 임나미!!!! 
35,써니,2011,"코미디, 드라마",9, 굉장히 심오한 메세지를 담고있는 영화다. 학생운동하면서 정의를 논하던 오빠가 악덕 업주가 되고 친구라는것도 결국 돈이 있어야 아름다운 마무리가 가능하다는 지독히도 현실적인 메세지 
36,써니,2011,"코미디, 드라마",10, 정말 옛시절을 생각하게하는 추억의영화.. 감동의 우정 
37,써니,2011,"코미디, 드라마",10, 다시봐도진짜재밌고감동이다진짜.최고다 
38,써니,2011,"코미디, 드라마",10, 전 한번 본영화는 질려서 잘안보는편인대써니는 언제봐도 재미있네요 ^^ 
39,써니,2011,"코미디, 드라마",8, 이제서야 봤지만 과거를 소재로 한것치곤 꽤 괜찮은 영화였다 돈얘기가 많은 것 같은데 오히려 금전적 요소를 우정과 대치시켜 생각하는 것 자체가 편견에 빠진 사람들같다 돈이 우정을 대변하진 않지만 어떤 사람들에겐 돈이... 
40,써니,2011,"코미디, 드라마",10, 최고! 보고또보고두번보고세번보고 다섯번보고 
41,써니,2011,"코미디, 드라마",10, 남성들만 찬란한 학창시절이 있는 것은 아니다. 여성들에게도 다시 오지 않을 철없지만 아름다웠던 질풍노도의 시기. 
42,써니,2011,"코미디, 드라마",10, 파란만장했던 시절의 추억이 가슴 뭉클하게 떠오른다 영화에 인물들처럼 우정스러운 친구는 내 곁에 없지만그래도 내가 한때 순수하게 꿈을 꾸고 노는것을 정말좋아했던 어렸을때에 내가 그리워져서 감동받았다 
43,써니,2011,"코미디, 드라마",10, 저희 어머님이 이 영화를 보고 울고 웃고 하시고 옛 생각 난다고 많이 씁쓸한 표정 지으셨어요 
44,써니,2011,"코미디, 드라마",9, 본드걸 상미의 이야기가 좀더 있었다면 좋겠는데 ㅠㅠ 보면서 상미가 불쌍하고 짠했다... 아무튼 6년이 지난 지금까지도 찾아보게되는 써니 명작이다 진짜 
45,써니,2011,"코미디, 드라마",10, 성인 나미가 써니멤버들이랑 찍으며 놀았던 영상 보는장면에서 멤버들이 각자의 꿈 이야기할때 너무 슬프면서 애틋했음 개인적으로 써니 최고 명장면 
46,써니,2011,"코미디, 드라마",10, 재미잇음너무재미잇음 
47,써니,2011,"코미디, 드라마",7, 슬픈 영화고 무서운 영화같아요. 다같이 좋았던 어린 시절과 달리 어른이 되버리고 삶의 모습이 차이가 나버리는게 정말 무섭고 슬픈 현실이잖아요... 
48,써니,2011,"코미디, 드라마",10, 돈갖고 뭐라하는 분들은 대체 무슨 파란만장한 결말을 기대하신 건지... ㅎ 친구니까 저정도로 해줄 수있었다고 생각하는데 ㅋㅋ잼있었음 
49,써니,2011,"코미디, 드라마",10, 나 이거 30번 넘게 봄.. 중독 개쩌는 영화ㅠㅠ 강소라가 소녀시대 때려눕힐 때 내가 다 설렘 하.. 
50,써니,2011,"코미디, 드라마",10, 최고! 스토리 배우들의 연기 촬영 편집 모두 완벽했다 
51,써니,2011,"코미디, 드라마",10, 한국영화 중 최고인거 같아요. 배급사들 장난쳐서 만든 천만영화들보다 훨씬 좋은 영화 
52,써니,2011,"코미디, 드라마",10, 돈으로 해결된게 아쉽다라.. 좀더 넓게 생각하면 당연히 이 사회가 돈으로 뭐든지 해결이 된다는점을 꼬집음과 동시에 주인공들이 단지 돈 하나때문에 그렇게 갖은 고생을 해왔음을 보여주는 증거인데.. 좀만 더 깊게생각하면... 
53,써니,2011,"코미디, 드라마",10, 내 나이 어느덧 40이 훌쩍넘어버렸다.. 적어도 나도 내 인생에서는 멋진 주인공 이였다는 사실 ~갑자기 눈물이 쏟아진다... 
54,써니,2011,"코미디, 드라마",10, 천우희 연기 진짜 잘한다. 멋져요 천우희씨!! :) 
55,써니,2011,"코미디, 드라마",10, 내가 웬만하면 영화나 드라마 봤던거 또 안보는데 써니는 5-6번을 봤다... 그랬는데도 또 보고싶고 가끔 생각나는 내 인생영화ㅠㅠ 진짜 너무 명작인듯.. 다 커서 여느평범한 아줌마가 되도 그때 그시절의 웃고떠들던 여... 
56,써니,2011,"코미디, 드라마",10, 자꾸 보고 싶은 영화 그냥 재밌다 너무 재미있는 영화다 
57,써니,2011,"코미디, 드라마",10, 슬프지만 끝은 행복한 영화 
58,써니,2011,"코미디, 드라마",9, 재밌다 ㅎㅎ 학창시절의 아련한 추억들과 함께... 
59,써니,2011,"코미디, 드라마",10, 천우희 배우의 본드녀 연기는 진짜 완벽했다. 
60,써니,2011,"코미디, 드라마",6, 쉬는시간에 친구들이 모이면 말 한마디에도 배꼽잡고 웃던 그때가 그립다 
61,써니,2011,"코미디, 드라마",10, 티비서 해주길래 보는데욕들을 너무 삐처리 해서 몰입을 깨네요 ㅠㅠ이 영화는 욕대사도 엄청 중요한 포인트인데.. 
62,써니,2011,"코미디, 드라마",10, 10번도 더 봤는데 나이가 들수록 더 감회가 새로운듯 정말 내 인생영화 ㅠㅠ 지금도 넷플릭스로 보고 질질짜는즁 
63,써니,2011,"코미디, 드라마",10, 어떻게 저렇게 닮은 사람 캐스팅해서 한지몰라.. 진짜 재밌음!!!! 인생영화 
64,써니,2011,"코미디, 드라마",10, 우리엄마도 나처럼 놀았구나 재밌게. 
65,써니,2011,"코미디, 드라마",10, 스포일러가 포함된 감상평입니다. 감상평 보기 마지막을 돈으로 해결한다고 결말이 별로다라고 하시는 분이 많은데 이건 일차원적 해석임. 금전적으로 도움을 준 것은 '춘화'가 수지네 집 앞에서 '못사는 년은 잘 살때 까지 괴롭혀줄거다.'... 
66,써니,2011,"코미디, 드라마",9, 굳............................................ 
67,써니,2011,"코미디, 드라마",10, 한국스럽다가 정말 잘 어울리는 영화수작 중 수작 
68,써니,2011,"코미디, 드라마",10, 이게 16살인가에 나왔는데 그땐 스토리 보고 웃기고 재밋었는데 고등학교도 졸업하고 나서 보니 학창시절모습들은 진짜 아련하니 그립더라... 맘에 더 와닿고.. 40이 넘어서 보면 또 다르겠지 그립다 고등학교시절..영원... 
69,써니,2011,"코미디, 드라마",10," 진짜너무 감동적이고 슬프고재미있었어요아직고등학생이지만 80,90년대 시대에살아본기분이 들었구요.엄마랑 함께보았는데 엄마도울고저도 울었네요.진짜 이런영화 많이나왔으면좋겠습니다 "
70,써니,2011,"코미디, 드라마",10, 결말이 아쉽다는 사람들은 이상주의자들인가? 
71,써니,2011,"코미디, 드라마",10, 이영화는 9살 더 먹고 다시 보니까 더 공감되고 감동이 엄청나는구만.. 
72,써니,2011,"코미디, 드라마",10," 주인공 유호정 오빠, 80년대에는 민주투사 데모하러 다니다가 2010년대에는 임금 떼먹는 악덕사장님 됨. 좃팔륙 대한민국 역사상 채고 쓰레기 세대를 과감없이 잘 표현한듯. "
73,써니,2011,"코미디, 드라마",10," 벌써 몇번을 봤는지 모를 정도로 방송에서 할때마다 꼭 봅니다. 이제 중학생인 저희 아들도 대사를 외울 정도로 재밌어 하는 영화네요. 항상 마지막에 제가 우니까 오늘도 아들이 다독여 줬습니다 옛 친구들, 돌아가신... "
74,써니,2011,"코미디, 드라마",10, 9년이나 됐네요.영화관에서 봤었는데...다시봐도 너무 뭉클합니다. 방금 티비에서 처음부터 끝까지 보고 찾아와서 써보네요.시간이 무척 빠르네요 벌써 2020년이라니 
75,써니,2011,"코미디, 드라마",10, 옛시절 잃어버린 기억의 조각들의 향연 
76,써니,2011,"코미디, 드라마",9, 16살 이라서 엄마 학창시절 때를 상상하면서 보게 한 영화 제 기준에선 재밌었고 슬펐어요 
77,써니,2011,"코미디, 드라마",10, ㅈㄴ재밋음 수지 너무 예뻐 
78,써니,2011,"코미디, 드라마",10, 아끼고 아끼다가 이제야 봤다. 왜이제야 봤을까.. 
79,써니,2011,"코미디, 드라마",10, 다시봐도 명작이네요... 
80,써니,2011,"코미디, 드라마",6," 우리의 학창시절, 친구들과의 재밌던 추억들. "
81,써니,2011,"코미디, 드라마",10, 와 이 명작을 지금에서야 봤어..보면서 엄마 생각도 나고 그랬네요 울 엄마의 학창시절은 어땠을까 싶고ㅎㅎ나중에 어른 되고 보면 훨씬 감명깊을것 같아요 
82,써니,2011,"코미디, 드라마",10, 대중적으로 잘 만든 영화. 
83,써니,2011,"코미디, 드라마",7, 학창시절 여자도 남자와 다를게 없구나 
84,써니,2011,"코미디, 드라마",10, 정말 재밌는데 한편으로는 그 시절 생각에 슬퍼진다...보고싶네 친구들 
85,써니,2011,"코미디, 드라마",10, 다시 봐도!시간이 지나도!정말 감동적이고 넘넘 재미있음!나중에 또 찾아볼 듯~ 
86,써니,2011,"코미디, 드라마",10, ㅋㅋ 이 영화 엄청 웃겨요~~^^ 잼나요~ 여자분들이 더 좋아 하실듯~^^ 
87,써니,2011,"코미디, 드라마",10, 
88,써니,2011,"코미디, 드라마",8, 오히려살믄서 인생은독고다이라고느끼고 그냥 친구라는걸떠나서 저어린시절이 그리운 ....내자신을 되돌아보게된다 
89,써니,2011,"코미디, 드라마",10, 
90,써니,2011,"코미디, 드라마",10, 
91,써니,2011,"코미디, 드라마",9, 다좋은데 왜 춘화역 진희경씨는 주연이아니고 특별출연으로 되있는건가요? 
92,써니,2011,"코미디, 드라마",10, 언제 봐도 따뜻한 영화내용 알고 있어도 재밌는 영화 
93,써니,2011,"코미디, 드라마",10, 크...학생때 보아도 성인이 되어 보아도 감동을 주는 영화.. 
94,써니,2011,"코미디, 드라마",10, 진짜 내 인생영화... 보면서 울고웃고 다했던듯... 
95,써니,2011,"코미디, 드라마",10, 최고다...한국영화 잘보지 않는데...써니는..영화가 끝나는게 아쉽다..ㅠ 
96,써니,2011,"코미디, 드라마",10, 명작이다 그냥 몇번 봐도 
97,써니,2011,"코미디, 드라마",10, 열번 넘게보니까..다른 장면보단 학교오르막길 보이자마자 눈물이 그냥 막 막 저냥 막 막 스토리 대사 이제 뻔한데.그냥 학교 올라가면서 타임슬립? 걍 서글프고 슬프다.ㅠ 
98,써니,2011,"코미디, 드라마",10, ㅜㅜㅜ 감동이다 ㅜㅜ 이런영화 너무 좋다 
99,써니,2011,"코미디, 드라마",10," 이런 친구들있다는게 얼마나 감사한것일까,, "
100,써니,2011,"코미디, 드라마",10," 학창시절 친구들이 생각났고, 우리엄마의 학창시절을 어땠을까 생각이 났다. 정말 멋진영화. "
101,써니,2011,"코미디, 드라마",8, 억지감동없는 수작.이게 진짜 여성서사지.걸캅스같은 가짜경찰이 아니라.저는 강소라(진희경)이 진짜 걸스두캔야니띵이러고 상각함.완전히 온전한 힘으로 사업을 일궜잖아요.그리고 이 영화는 정치편향이 없어서 좋아요.다른영화는... 
102,써니,2011,"코미디, 드라마",10," 재미. 감동. 교훈(운동권의 민낯)까지 다룬, 삼박자를 고루 갖춘 영화. "
103,써니,2011,"코미디, 드라마",10, 나미가 찍은 비디오보며 회상하는 장면에서는 가슴이 저리다못해 에리다 
104,써니,2011,"코미디, 드라마",10, 캐릭터 하나하나 매력 넘쳐서 볼맛났다 
105,써니,2011,"코미디, 드라마",10, '돈으로 해결되는게 단점이다' ㅇㅈㄹ 네 다음 돈없는 친구둬서 ㅂㄷㅂㄷ중인놈ㅋㅋ 영화를 왜 그렇게 감성적으로만 보려드니.. 돈으로 해결되는 부분이 영화스토리라곤 생각안해봤니? 한국은 너무 향수에 관대한... 
106,써니,2011,"코미디, 드라마",10, 단순한 코믹영화가 아님....레트로 영화의 새로운 교과서... 
107,써니,2011,"코미디, 드라마",8," 상대가 어떤사람인지, 누구를 만나고있는지 알 생각도 안하고 첫눈에 반해 지독한사랑에 빠질수 있었던 그시절, 내 역사의 주인공이었던 내가 떠올라 다시 볼때마다 가슴이 흐물? 눈물이 그렁해지는 영화. "
108,써니,2011,"코미디, 드라마",10, 
109,써니,2011,"코미디, 드라마",10, 되게 웃기고 재미있는 영화였습니다 
110,써니,2011,"코미디, 드라마",10, 죽기전에 영화 딱 하나만 보고 죽으라하면 망설임 없이 써니를 택할것이다. 그리고 그전에 평식이 ㅈㄴ 쌔게 1대만 갈기고싶다 
111,써니,2011,"코미디, 드라마",10, 재밌어용 7080 스토리여도 공감되네요 ㅎㅎㅎ 
112,써니,2011,"코미디, 드라마",10, 천우희의 신들린 먹방 연기에 10점. 
113,써니,2011,"코미디, 드라마",10, 오랜만에 티비에 나왔는데 너무 좋았어요 영화하나 진짜 잘만들었어요!!!! 
114,써니,2011,"코미디, 드라마",10, 
115,써니,2011,"코미디, 드라마",10, 이영화는 죽기전에 봐야할 영화 리스트에 올려놔야한다 한국영화치곤 명작 
116,써니,2011,"코미디, 드라마",10, 써니I LOVE YOU! 
117,써니,2011,"코미디, 드라마",10, 정말 잘 만든 영화. 볼때마다 재밌음. 
118,써니,2011,"코미디, 드라마",9, 
119,써니,2011,"코미디, 드라마",10, 내 최애영화할머니가아악!!!! 
120,써니,2011,"코미디, 드라마",10, 내 우정 얘기도 아닌데도 재밌다 
121,써니,2011,"코미디, 드라마",10, 80년대 내 친구들 보고싶다 
122,써니,2011,"코미디, 드라마",7, 유쾌하고 재밌었는데 마지막에 장례식장에서 배금주의가 너무 심하고 노답이다...그리고 그당시 본드하는애가 천우희인줄 몰랐는데 다시보니까 너무웃기고 신기하다ㅋㅋㅋㅋ 
123,써니,2011,"코미디, 드라마",8, 나름 중2병가졌었던 중학생때 본적있는 영화인데 감정이입이 잘되서좋았어요 
124,써니,2011,"코미디, 드라마",10, .고공백제외하고10글저 
125,써니,2011,"코미디, 드라마",10, 
126,써니,2011,"코미디, 드라마",10, 인생 영화입니다 이런 영화를 만들어주셔서 감사할 따름 
127,써니,2011,"코미디, 드라마",10, 엄마의 학창시절이 궁금해지는 
128,써니,2011,"코미디, 드라마",10, 91년생 유호정하면 딱 떠오르는 영화는 써니일것같고 앞으로도 그러지싶다 이 영화가 왜 천만이 아닌지 의아할뿐 
129,써니,2011,"코미디, 드라마",10, 배우들 연기력 대박.. 
130,써니,2011,"코미디, 드라마",10, 옛날 생각이 새록새록. . .^< 
131,써니,2011,"코미디, 드라마",10, 우리들의 청춘을 기억하게 만드는 영화 
132,써니,2011,"코미디, 드라마",10, 다시봐도 항상 훈훈하고 좋은영화 
133,써니,2011,"코미디, 드라마",6, Sunny Sunny 
134,써니,2011,"코미디, 드라마",7, 마지막만 바꾸면 되겠어. 
135,써니,2011,"코미디, 드라마",10, 완벽한 영화 
136,써니,2011,"코미디, 드라마",6," 그 볼 장면인 넘 충격적임.. 첨봤을때도 고통스러웠고, 2번째 보기에도 고통스러울거 같아서 눈가리고보게됨.. 개인적으로은 그 장면 전까만 재밌었던것 같아요..! 웰메이드임에도 불구하고 고통스러워서 여러번 보기는 두려... "
137,써니,2011,"코미디, 드라마",10, 다시 봐도 새롭게 느껴지고 감동적이다 세월에 장사 없구나... 
138,써니,2011,"코미디, 드라마",10, 재방송보는데 고등학교친구들이 생각난다.. 
139,써니,2011,"코미디, 드라마",10, 8년전 영화지만 최고입니다. 
140,써니,2011,"코미디, 드라마",8, 명작 그시대 참 잘 살렸다 압으로도 계속 기억에남고 보게될 추억영화 
141,써니,2011,"코미디, 드라마",9, 어쩌면 잊었을 그 시간을 위해 
142,써니,2011,"코미디, 드라마",10, 오랜만에 다시보니까 새롭네ㅠㅠ 진짜 재밌고 감동적인 영화 최고임ㅠㅠㅠㅠ이게 벌써 7년전 영화라니.. 
143,써니,2011,"코미디, 드라마",9, 진짜 한국영화 수작중에 하나 
144,써니,2011,"코미디, 드라마",10, 많이 울었다 앞날과 지난날의 회고록 
145,써니,2011,"코미디, 드라마",10, 우정을 정말 잘 표현해낸 영화 ... 
146,써니,2011,"코미디, 드라마",8," [가장 현실적인 평점] 1~3점:쓰레기 / 4~5점:살면서 모르고 살아도 무방 / 6점:뭔가 나사빠진듯 2% 부족 / 7점:그런데로 평타 / 8점:이정도면 남에게 추천가능한 수작 / 9점:소름, 전율이 느껴지는걸작 ... "
147,써니,2011,"코미디, 드라마",10, 
148,써니,2011,"코미디, 드라마",10, 10번을 봐도 그때마다 터지는 재미와 감동... 무조건 소장각!!! 
149,써니,2011,"코미디, 드라마",5, 뭐 그냥저냥 볼만함 다만 끝에는 정말 말도안됨 
150,써니,2011,"코미디, 드라마",10, 오늘째만40번째 넘게본거같아요..이제서야 평점을남기네요.인생 영화죠 .왠만한 여자분들의 공감과 추억을 사는 영화인것같아요.각자의 캐릭터 매력들뿐아니라 스토리도 정말....제 시절도 ..제가 격었던이야기도 아니지만..... 
151,써니,2011,"코미디, 드라마",9, 재미있는 부분도 있겠지만 감동적이고 연출 아이디어가 너무 좋아서 몇번 봐도 질리지 않네요 
152,써니,2011,"코미디, 드라마",10, 
153,써니,2011,"코미디, 드라마",1, 스포일러가 포함된 감상평입니다. 감상평 보기 민효린 예쁜데 결혼해서 1점 드립니다 
154,써니,2011,"코미디, 드라마",10, 추억이 왜 즐겁고 아름다운지 잘 보여준 영화. 따듯하다 
155,써니,2011,"코미디, 드라마",10, 
156,써니,2011,"코미디, 드라마",10, 굿귯규수규슈굿ㅅ귝 ㄱ ㄱ 규숙구굿 
157,써니,2011,"코미디, 드라마",10," 가슴이 찡하면서도 즐겁고, 감동과 재미 모두 있습니다 제가 본 영화중에 제일 재밋는 영화입니다 "
158,써니,2011,"코미디, 드라마",10, 진짜 인생영화ㅠㅠ 볼 때마다 웃기고 슬프고 다한다 .. 
159,써니,2011,"코미디, 드라마",10, 
160,써니,2011,"코미디, 드라마",10, 그렇게 슬픈 장면은 없는데 눈물 짜는 중 ㅠㅠ흑흑 
161,써니,2011,"코미디, 드라마",10, 티비에서 할 때마다 꼭 봤다. 볼 때마다 마음 한 켠이 몽글몽글해지고 유쾌한 영화. 학창시절이 많이 그립다. 그때 그 친구들과 내가 그립다. 지나고 나니 알겠더라 얼마나 아름답고 순수하고 소중한 시간들이였는지. 
162,써니,2011,"코미디, 드라마",10," ""난 왜 이런친구가 없을까 말고 이런친구가 되어야겠다"" 라는말이 있는데 이런친구가 되려고 노력할수록 남는건 '나만 놓으면 끝나는 관계' 뿐이다. 오랜만에 이영화를 다시보며 많이 웃고 많이... "
163,써니,2011,"코미디, 드라마",10, 걍최고. 어린나이의사람이보아도단연최고입니다 
164,써니,2011,"코미디, 드라마",7, 써니 아니였던 사람 없다그래서 빛나는 거야 이 영화가엄마랑 봤는데 엄마도 써니였고 나도 그랬구써니를 먹으면 써니냄새..가 나고.. 
165,써니,2011,"코미디, 드라마",10, 추억이라능 ~!>< 
166,써니,2011,"코미디, 드라마",10, 이영화를 보고 내가 더 커서 지금 현재가 되서 어린시절과 얼마나 달라질지 생각하게된 영화이다 
167,써니,2011,"코미디, 드라마",10, 정말 명작인 영화입니다 
