,title,year,genre,score,review
168,써니,2011,"코미디, 드라마",10, 오랜만에 다시 봤는데 느낌이 또 새롭네요 신났던 장면만 기억해서 봤다가 울고 웃고 울었네요 
169,써니,2011,"코미디, 드라마",9," 시간이 지나고나서야 또 보는것이지만 어쩌면 현시대, 뉴트로의 OO점 아니였을까 "
170,써니,2011,"코미디, 드라마",10, 우정을 되새기고 싶을 때 꼭 찾아서 보는 영화 
171,써니,2011,"코미디, 드라마",9, 중학생때부터인 친구들이랑 같이봐서 더 뭉클했다.내 추억속의 한페이지를 차지하는게 아니라 같이 계속 추억을 만들어주는게 쉬운게 아닌걸 아니까.물론 싸우기도 하고 서로 연락안할때도 있지만 1년에 한번씩 꼭 만나서 여행가... 
172,써니,2011,"코미디, 드라마",10, 몇번을 봐도 여운이 남는 영화 
173,써니,2011,"코미디, 드라마",10, 엔딩빼고 모든게 완벽했다. 
174,써니,2011,"코미디, 드라마",9, 그시대 학창시절을 보내서 그런지 공감이 많이 된다. 친구는 역시 부자친구가 최고 
175,써니,2011,"코미디, 드라마",10, 진짜 몇번을 다시 보는지ㅠㅠ 너무 감동적이고 재밌다 요즘은 느낄 수 없는 옛 시절의 우정을 잘 그려낸 것 같다 매번 봐도 너무 감동적이다 
176,써니,2011,"코미디, 드라마",10, 생각나서 다시 찾아봤는데 학창시절생각이 아른합니다 너무 감동적이에요 
177,써니,2011,"코미디, 드라마",10, 모든게 완벽한 최고의 영화 
178,써니,2011,"코미디, 드라마",10, 명작입니다 그 이상 할말이 없네요 아련하네요~ 
179,써니,2011,"코미디, 드라마",10, 이제 보다니ㅠㅠ 재밌으면서도 감동적이고 그럼 
180,써니,2011,"코미디, 드라마",9," 12.02.08.마지막 친구들에게 남겨주는 선물은 억지성이 과했지만, 그 정도는 넘어가줄 수 있다. "
181,써니,2011,"코미디, 드라마",10, 이영화에 고준이 나오다니.티비서 해주는거 보다가 낯익은 얼굴보고 깜놀.저때도 잘생겼었구나ㅋ 
182,써니,2011,"코미디, 드라마",10, 정말 잘 만든 영화다.. 
183,써니,2011,"코미디, 드라마",8, 90년대 세대가 아니라서 그냥저냥 재미만있었다 
184,써니,2011,"코미디, 드라마",8, 정말 잘 만든 영화... 
185,써니,2011,"코미디, 드라마",10," 참 잘 만든 영화, 마음이 따뜻해지는 영화, 볼 때 마다 눈물 흘리는 영화! "
186,써니,2011,"코미디, 드라마",10, 다시봐도 꿀잼 천우희의 연기가 빛나는듯 
187,써니,2011,"코미디, 드라마",10, 인생영화중 하나 너무 재미있다. 
188,써니,2011,"코미디, 드라마",10, 아직도 제일 깊게 남은 영화이자 지금까지 보는 영화 
189,써니,2011,"코미디, 드라마",10, 봐도봐도 재밋어...ㅠ 
190,써니,2011,"코미디, 드라마",10, 티비 채널 돌리다가 하고있으면 항상 보는영화엄마생각나서 짠하기도 하고늙는게 뭔지 서글프기도 하다 정말 잘만든 한국영화 ! 
191,써니,2011,"코미디, 드라마",10, 언제봐도 너무 잘 만들었다 
192,써니,2011,"코미디, 드라마",10, 최고 너무 재미있게 봤어요 
193,써니,2011,"코미디, 드라마",10, 너무 찬란했던 그 추억을 소환한 최고의 영화 
194,써니,2011,"코미디, 드라마",8, 이거볼때마다느끼는건 진이남편은 장미네오빠야? 
195,써니,2011,"코미디, 드라마",10, 설특선영화로 보는데 완전 감동이네 
196,써니,2011,"코미디, 드라마",10," 딸생각에 우는 장면, 깨진유리로 얼굴긋는 장면, 친구들한테 돈나눠주는 장면 "
197,써니,2011,"코미디, 드라마",8, 나름 볼만했던 영화라서 8점 
198,써니,2011,"코미디, 드라마",10, 저의 인생작인것 같아요 진짜 추천작 
199,써니,2011,"코미디, 드라마",8, 진짜 옛날에 봤는데 다시보니 그때 극장에서 봤던날이 생각이나네ㅋㅋ그때는 별기대안하고 그냥 본건데 나름 재미있어서 놀랐던영화ㅋㅋ 수수한매력이있는 영환데 마지막이 아쉬웠음ㅋㅋ 
200,써니,2011,"코미디, 드라마",8, 몰입을 할 수 있는 여러가지 요소들을 적절히 담아 보고나면 여운이 남는 영화 
201,써니,2011,"코미디, 드라마",8, 나도 저렇게 옛 기억에 있는 좋은 사람들 찾아서 추억에 젖어 만나고 싶다... 
202,써니,2011,"코미디, 드라마",8, 마지막 장면은 좀 에바참치꽁치멸치 전우치였다 
203,써니,2011,"코미디, 드라마",9, 내 역사 속 주인공은 나우린 모두 주인공인 삶을 살고있다 
204,써니,2011,"코미디, 드라마",9, 소품 하고 내용. 소품 하고 내용. 
205,써니,2011,"코미디, 드라마",9, 캐스팅이 정말 최고다. 
206,써니,2011,"코미디, 드라마",10, 아주 좋아요 재미있었어여 
207,써니,2011,"코미디, 드라마",10, 이런 영화가 좋다... 
208,써니,2011,"코미디, 드라마",10, ㅠㅠ연기도 너무 잘하고 진짜 현재-과거 이어지는 부분이 너무 잘연결되서 좋았어요ㅠㅠ 강소라씨 캐릭터는 완전 매력터짐 반할뻔 ㅜㅜ 몇번을 봐도 재밌고 감동도 있네요 진짜 명작입니다. 
209,써니,2011,"코미디, 드라마",7, 각자 인생의 주인공.추억을 먹고 사는 우리들...고딩 시절 연기자들이 이 영화의 최대 수확 
210,써니,2011,"코미디, 드라마",9," 어린 시절을 떠올리게 하고, 친구들의 소중함을 느끼게 하는 장면, 모두가 좋았다. 단, 마지막에 지나친 해피엔딩인게 오히려 비현실적인듯.. "
211,써니,2011,"코미디, 드라마",9, 여운 쩔어....ㅠ 재밌다 
212,써니,2011,"코미디, 드라마",10, 몇번을 봐도 질리지 않는 영화인 것 같다. 이렇게 시간이 지나도 가슴속에 깊이 남고 다시 보고 싶어 지는 영화는 이게 최고인 것 같다. 영화 장면 장면을 생각하면 설레고 기분이 좋아진다. 중간중간 나오는 노래가 이 ... 
213,써니,2011,"코미디, 드라마",8, 처음에 봤을때와 두번째 봤을때는 또 다른 느낌 
214,써니,2011,"코미디, 드라마",9, 간만에 국내영화중에 코미디 드라마 장르 밸러스가 좋은 영화를 본 듯하다. 욕배틀에서 웃겨서 눈물을 흘렸고 큰 나미가 어린나미를 보듬어주는 장면에서 여운이 .. 맨 마지막 장면에서는 진정한 우정을 보았다. 남은 친구... 
215,써니,2011,"코미디, 드라마",8, 어렸을적 우정 의리 나누던 학창시절 친구끼리도 커서는 의리에 비례가 돈으로 해결되는는구나라고 다시 한번 마지막 장면으로 통해 느끼게 해준 자본주의 영화 . 
216,써니,2011,"코미디, 드라마",9," 심은경은 이거찍을때가 18살,,ㅎㄷㄷ "
217,써니,2011,"코미디, 드라마",10, 가끔생각나는영화 가슴이뭉클해지는영화 아쉬움업는영화다 
218,써니,2011,"코미디, 드라마",10, 어의 잘생긴오빠 내가 피해자 입장일때다시오면 안될까? 
219,써니,2011,"코미디, 드라마",10, 벌써 6년... 배우들이 이쁘장하다 
220,써니,2011,"코미디, 드라마",6, 재밌게 잘봤습니다. 다만 결말이 좀... 
221,써니,2011,"코미디, 드라마",10, 몇번을 봐도 재밌네요굳... 
222,써니,2011,"코미디, 드라마",10, 나는 남자인데도 너무 재밌게 봤습니다.아마 여자들의 우정이 저런거겠구나 싶네요. 전부는 아닐지언정 일부라도 공감시켜주셔서 감사합니다. 여러번 봤네요~^^* 
223,써니,2011,"코미디, 드라마",10, 과거와 현재의 교집합. 
224,써니,2011,"코미디, 드라마",10, 6년 전 미혼일 때 본 거랑은 또 다르네요. 결혼하고 40이 돼가는 나이에 보니 너무 공감가네요. 6년 전엔 그냥 학창시절 추억만 떠오르게 했는데 지금 보니 아줌마가 된 여자들의 각기 다른 삶이 너무 공감되네요. 마... 
225,써니,2011,"코미디, 드라마",8, 이 영화보고 싸웠던 고1친구에게 사과문자 보냈네요..참고로 저는 이제 24살이구요..고마워요 이영화보고 용기내서 먼저 문자보냈네요ㅎㅎ 
226,써니,2011,"코미디, 드라마",10, 이거 되게 재밌게 봤었는데 추억이네 
227,써니,2011,"코미디, 드라마",10, 칼빵만 아니면 거부감 없이 즐기는건데.... 
228,써니,2011,"코미디, 드라마",6, 학창시절의 느낌을 받고 싶은 40대 여성들에게.. 
229,써니,2011,"코미디, 드라마",10, 재밋어요 울면서봄ㅠㅠ 
230,써니,2011,"코미디, 드라마",10, 재미있습니다 ㅎㅎㅎㅎ 
231,써니,2011,"코미디, 드라마",7, 대한민국 모든 아줌마들께 이 영화를 바칩니다. 
232,써니,2011,"코미디, 드라마",10, 볼수록 너무 좋아요 고딩때나온영환데 그때친구들끼리 영화관가서 니는 누구 나는 누구 하면서 역할정했던 기억이나네요 지금봐도 감동 입니다 이런영화를 욕하시는분은 생각이 어디로가셧나요 ㅠ 잘봤습니다 꾸벅!! 
233,써니,2011,"코미디, 드라마",10," 90년대에태어난 20대입니다왜인지는모르지만 제자신이 초라하고혼자라느껴질때마다 아련하게떠오르는영화가써니입니다 80년대를잘알지도, 겪어본적도없지만꼭살아보고싶은 그속에숨쉬어보고싶게만듭니다. 제가 지금의80년대생처럼 4-5... "
234,써니,2011,"코미디, 드라마",9, 학교다닐때가 가장 행복했다는...아 옛날이여 ㅋㅋ 
235,써니,2011,"코미디, 드라마",8, 10대가 봐도 재밌었던 영화.. 심은경이 빛났던 
236,써니,2011,"코미디, 드라마",10, 오래봐도 손색없는 클래식 같은 영화 
237,써니,2011,"코미디, 드라마",9, 이영화는 마지막장면에 돈으로 해결하는장면대신 감동적인 명대사몇마디 탁넣어줬으면 한국최고명작영화중에 하나였을텐데 아쉬움..그래도 여운이 많이남는 명작이지 
238,써니,2011,"코미디, 드라마",10, 재미잇당101010 
239,써니,2011,"코미디, 드라마",10, 급마무리하는것같았지만해피엔딩^^ 
240,써니,2011,"코미디, 드라마",8, 어릴적 추억이 생각이 난다...나도 그땐 그랬는데.... 
241,써니,2011,"코미디, 드라마",8, 정말 재미있었습니다. 
242,써니,2011,"코미디, 드라마",10, 딸운동회무용이 써니댄스~~ 문뜩 영화가 다시생각나 봤는데 몇번을 봐두정말 감동과 웃음을 준다 간직하구싶은 영화 
243,써니,2011,"코미디, 드라마",8, 중간중간에 너무 오글거리는 것 빼고는 재미있게 봤어요. 그냥 뭐랄까 아주 조금 뭔가 아쉬운 것들만 빼구요. 
244,써니,2011,"코미디, 드라마",10," 볼때마다 엄마미소로 보다가 행복해지는 영화. 연출, 개연성.. 한국영화중 수작. "
245,써니,2011,"코미디, 드라마",7, 작위적인 부분이 있긴 했지만 재미있게 봄. 뭔가 찡함이 있었다 
246,써니,2011,"코미디, 드라마",10, 순수했던 10대의 우정을 잘 그려낸 영화 
247,써니,2011,"코미디, 드라마",10, 나에게 영화라붐이랑 소피마르소를 알게한영화 
248,써니,2011,"코미디, 드라마",10, 언제봐도 다시봐도 항상 재밋음 
249,써니,2011,"코미디, 드라마",10, 몇번을 봐도 질리지 않고 몇번을 봐도 재밌는 영화 
250,써니,2011,"코미디, 드라마",8, 마무리가 현실성이 없지만..(친구는 끼리끼리놀죠 보통..) 이정도면 고퀄리티 영화입니다. 
251,써니,2011,"코미디, 드라마",10, 어쩌면 인간에게 가장 필요한 친구라는 이름 
252,써니,2011,"코미디, 드라마",10, 돈으로 해결되는 마지막 부분이 현재 사회를 비판하기 위해서 나온거 아닌가?대체 무슨 문제지ㅋㅋ 
253,써니,2011,"코미디, 드라마",10, 내가본 최고의 우정영화..ㅠ 
254,써니,2011,"코미디, 드라마",10, 진짜써니 재미있어요 또보고싶어요 
255,써니,2011,"코미디, 드라마",10, 복고 향수를 불러 일으킨 영화! 
256,써니,2011,"코미디, 드라마",10, 내가본영화중최고!! 
257,써니,2011,"코미디, 드라마",8, ㅎㅎㅎ 기분 좋은 영화 이야기 좋다 
258,써니,2011,"코미디, 드라마",10, 굳입니다요 좋습니다요 
259,써니,2011,"코미디, 드라마",7," 그 시절, 행복했던 추억 "
260,써니,2011,"코미디, 드라마",10, 개인적으로 너무 좋았던 
261,써니,2011,"코미디, 드라마",10, 응답하라1988보다 이 영화가 더 80년대 10대들의 생활상을 더 리얼하게 잘그려낸거 같음 
262,써니,2011,"코미디, 드라마",10, 내 친구들이 오랜만에 보고싶어졌다 
263,써니,2011,"코미디, 드라마",10," 추억과 재미, 감동이 살아있는 작품 "
264,써니,2011,"코미디, 드라마",10, 굳굳굳굳개잼개잼:) 
265,써니,2011,"코미디, 드라마",10, 다시봐도 재밌네... 
266,써니,2011,"코미디, 드라마",10, ㅇㅇ잼좋앙ㅇㅇㅇ열저열자 
267,써니,2011,"코미디, 드라마",8," 영화 자체는 좋은 점도 나쁜 점도 있었는데, 어쨌든 강소라가 왜 그렇게 갑자기 떴는지는 알겠다. "
268,써니,2011,"코미디, 드라마",10, 써니 그 이후... 태지가 나오고^^ 
269,써니,2011,"코미디, 드라마",10, 감동적이었던 추억영화 
270,써니,2011,"코미디, 드라마",10, 진심 옛추억생각나게하는 영화 남자지만..너무 감동적인 
271,써니,2011,"코미디, 드라마",10, 진짜 너무 재밌네용 ㅜㅜ흑흑 
272,써니,2011,"코미디, 드라마",10, 봐도봐도 재밌네요~~ 
273,써니,2011,"코미디, 드라마",10, 정말 재미있었음 민효린이랑 강소라랑 심은아 너무 이쁨 ㅠㅠ 
274,써니,2011,"코미디, 드라마",10, 정말 수작임! 억지로 전개하지 않고 시공을 넘나드는 사건의 개연성도 탁월함. 
275,써니,2011,"코미디, 드라마",10, 내가 저 시대애 살진 않아서 잘은 모르지만 그래도 너무 재미있는 영화다ㅎㅎ 
276,써니,2011,"코미디, 드라마",10, 복고의 매력감독님 뭐하세여 
277,써니,2011,"코미디, 드라마",8, 정말 잘만든 청춘물. 이런영화 좋습니다. 특히 하춘화가 병원에서 고통스러워하는 장면은 되게 슬펐어요 
278,써니,2011,"코미디, 드라마",10, 감동...개OO쩌러 
279,써니,2011,"코미디, 드라마",10, 정말 잘만들었다.... 
280,써니,2011,"코미디, 드라마",6, 써니같은 친구들 있었으면 좋겠다. 
281,써니,2011,"코미디, 드라마",9, good good good 
282,써니,2011,"코미디, 드라마",10, 말이 필요할까요. 세번째 보면서 평점남깁니다~ 
283,써니,2011,"코미디, 드라마",10, 진짜재밌어요!진짜 꼭한번 보셔야됨 
284,써니,2011,"코미디, 드라마",10, 뭔가 내 가슴에 남아있는 소장하고싶은 영화 
285,써니,2011,"코미디, 드라마",10, 그룹들 멋잇당 ㅋㅋ 나두 저런사람끼리 친해지고 싶다 하긴 순진한 사람들 건들다간 폭발이지 ㅜㅜ 
286,써니,2011,"코미디, 드라마",10, 보기드문 아름다운 영화. 잔잔한 감동. 
287,써니,2011,"코미디, 드라마",8, 특집으론 그만하자.. 
288,써니,2011,"코미디, 드라마",10, 진짜 이 영화는 와 말로 못할만큼 재밌음!!!! 
289,써니,2011,"코미디, 드라마",8, 영화를 보는 내내 나도 학창시절에 저런 친구들 있었으면 얼마나 좋을까 하는 생각이 들면서 그저 부럽단 생각만 들었음...ㅋ 
290,써니,2011,"코미디, 드라마",10," 5번을 봐도 웃음과 눈물,감동을 주는 영화. 국내 동일 장르영화중 최고 "
291,써니,2011,"코미디, 드라마",10, 찬란했던 학창시절을 떠올리며.. 
292,써니,2011,"코미디, 드라마",10, 시대를 떠나서 친구들간에 우정이 공감할 수 있어서 재미있었고..갠적으로 춘화 성격이 무지 짱짱이였음. 으리! 
293,써니,2011,"코미디, 드라마",9," 결말에 돈으로 해결되는 부분만 없으면 깔끔했을텐데, 슈퍼히어로 영화도 아니고 모든 문제를 해결하고 끝내려고 하네 "
294,써니,2011,"코미디, 드라마",8, 아름다운 한 시대의 시작과 퇴장 
295,써니,2011,"코미디, 드라마",10, 재밌네요...추억에 젖게 만드네요 
296,써니,2011,"코미디, 드라마",9, 연기도 연출도 스토리도 감동 그 자체. 보면서 학창시절을 떠올리게 해주고 친구들과 잃어버린 꿈을 기억나게 해주는 영화 
297,써니,2011,"코미디, 드라마",10," 아.. 정말 캐릭터 하나하나 다 살아있어서 좋았고... 무엇보다도 시나리오 연출력... 완벽.... 영화 참 ""잘"" 만들었다. "
298,써니,2011,"코미디, 드라마",10, 따뜻한 영화! 봐도 봐도 재밌어요 
299,써니,2011,"코미디, 드라마",8, 친구들의 우정을 잘 보여주는 영화다. 지금 친구들과 연락을 끊지 말고 커서도 연락하고 지내고 싶고 친구들의 돈독한 우정은 정말 멋있다 
300,써니,2011,"코미디, 드라마",10, 완전재밌어요 저도 이런 친구가 되었으면 좋겠어요 
301,써니,2011,"코미디, 드라마",10," 진심 레전드 ㅜ 별점 1 준 사람들은 그냥 거의 그시대 이해안가서 이렇게 준듯 ,, 근데 여자가 볼때는 진심 졸잼꿀잼이었음 ㅜ 이거보고 천우희 연기력 소름 ㅜ 개좋음 진짜 "
302,써니,2011,"코미디, 드라마",10, 10점이 모자른영화..몇번봐도 감동적이고 마지막까지깔끔했다.내생애 최고의 영화. 
303,써니,2011,"코미디, 드라마",9," 돈으로 해결되는 부분이나 고딩들과의 패싸움 등은 지금은 어른이 된 그 세대가 갖는 판타지라고 생각하면 된다. 누군들 그러고 싶지 않겠는가? 남자고, 그 세대를 겪지 않았지만 이 정도면 충분히 수작 중에 수작이라고 ... "
304,써니,2011,"코미디, 드라마",9, 여자영화가 아닌 모든이들의 담백한영화 
305,써니,2011,"코미디, 드라마",10, 심은경 나오면 믿고보는거죠 ^^ 
306,써니,2011,"코미디, 드라마",9, 과거의 풋풋함 그리고 성공한 돈의맛 둘다 괜찮았음 대리만족도 되고 
307,써니,2011,"코미디, 드라마",10, 진짜 내인생영화 정말재밌다좋아요 다시봐도봐도재밌네요 
308,써니,2011,"코미디, 드라마",9, 잘만든 학창시절 영화. 추억이 새록새록. 
309,써니,2011,"코미디, 드라마",10," 가족,친구가 가장 소중하지ㅎㅎ "
310,써니,2011,"코미디, 드라마",10, 요즘 보기드문 웰메이드영화. 재밌게 잘봤습니다. 
311,써니,2011,"코미디, 드라마",10, 진짜 여러번봐도 질리지않는 영화같아요 울고웃고 감동적인 우정도 있고 좋은 영화네요~ 
312,써니,2011,"코미디, 드라마",9, 현재의 나미와 과거의 나미가 만나는 장면들이 참 좋았다... 나는 아직 나이가 많지 않지만 학생 때 꿈 많았던 나를 상실한 것 같다. 비록 동일세대는 아니었지만 써니는 공감할 수 있는 영화였다. 
313,써니,2011,"코미디, 드라마",10, 와 진심 재밌다 왜 이걸 지금보는지모르겠네 아니 걍 너무재밌음 진짜 후회안함 
314,써니,2011,"코미디, 드라마",10," 그냥 존나 각설하고, 한국영화에서 희망을 봤음. "
315,써니,2011,"코미디, 드라마",10, 이영화 재미 있엉영 ㅇㅋ 지금 보면 100번 봤엉영 ㅇㅋ 앞으로도 잘 부탁행영 ㅇㅋ 
316,써니,2011,"코미디, 드라마",10, 말이 필요없ㄷㅏ ㅠ ㅠ 한 5번넘게 본 듯 
317,써니,2011,"코미디, 드라마",10, 막판 돈의힘 빼고는 그럭저럭 캐릭터설정도 그렇고 괜찮았음 
318,써니,2011,"코미디, 드라마",10, 짱입니다 정말 ~♥!!! 
319,써니,2011,"코미디, 드라마",10, 정말 과거를 떠올리게 하는 최고의 영화인것 같습니다.. 
320,써니,2011,"코미디, 드라마",6, 가장 빛나던 시절 소녀들에게는 꿈이 있었다. 현대사회의 다양한 여성들로 성장한 그녀들이 다시 뭉쳤다. 써니 !!! 
321,써니,2011,"코미디, 드라마",8, 남자든 여자든 예전의 학창시절 추억과 친구들을 생각하게 하는 영화 
322,써니,2011,"코미디, 드라마",10, 아직까지 봐도 재밌다 추억이 깃들었다 
323,써니,2011,"코미디, 드라마",8, 청춘 예찬의 대표작으로 길이 남을 걸작 
324,써니,2011,"코미디, 드라마",8, 베스트댓글에 동의.. 
325,써니,2011,"코미디, 드라마",10, 나는 지금 시대를 살아가는 인물로서 이 영화는 여자의 우정을 표현하기에 정말 최고인 영화인듯 ㅠㅠ 근데 이거 매 해 볼때마다 연말에 안좋은 일 생기는 징크스 생겨서 이제 안봄.. 중1때부터 중3때까지 일년에 한번씩은... 
326,써니,2011,"코미디, 드라마",10, 정말 소름돋게 좋은 영화다이런영화는 많이 나와야 한다. 
327,써니,2011,"코미디, 드라마",9, 다시는 돌아갈수없는 청춘의 소중함과 그리움을 깨닫게해줌. 20대인데도 눈물 펑펑 쏟으며 봤었어요 ㅎㅎ 
328,써니,2011,"코미디, 드라마",10, 내 인생 최고 영화!오랜 시간 기억에 남을 꺼에요 
329,써니,2011,"코미디, 드라마",10, 다시 봐도 재밌다 과거로 돌아가고싶다 
330,써니,2011,"코미디, 드라마",9, 이상하게 웃음지으면서 눈물이 뚝뚝떨어지네.. 
331,써니,2011,"코미디, 드라마",10, 캐릭터가 꽤 많음에도 불구하고 누구 하나 불청객 없이 각각의 특징적인 인물로 살아났던 영화. 그 시절을 살아보고 싶을 만큼 좋았다. 
332,써니,2011,"코미디, 드라마",7, 재밌게봤는데 마지막마무리가 너무 아쉽네요 
333,써니,2011,"코미디, 드라마",9," 과거/현재 맛깔나는 캐릭터들을 잘버무렸다 어느하나 평범한것 없었고 또 특정시대를 표현하는데 거부감없이 잘 받아들일 수있었고, 가장 마음에드는 것은 현실시대에서 과거 주인공들의 삶이 다양한 점이었다. "
334,써니,2011,"코미디, 드라마",8, 7080세대를 향한 유쾌한 찬가. 
335,써니,2011,"코미디, 드라마",5, 그런데로 괜찮은 영화였는 데 허접한 결말이 공든 탑을 무너트린다. 마치 감독 스스로 '난 돈이 먼저야!'라고 외치는 것과 같은 느낌이다. 결론은 그냥 메세지따위는 없는 상업영화. 
336,써니,2011,"코미디, 드라마",10, 하루에 한 번씩은 꼭 보는 것 같다. 볼 때마다 울고 웃고 감탄하게 되는 영화다. 내 인생영화. 
337,써니,2011,"코미디, 드라마",10," 진짜감동과웃음을동시에주는영화이고,몇번이고계속보게되는영화같다.이주인공들그대로써니2는안나오나요ㅠㅠ "
338,써니,2011,"코미디, 드라마",10, 마지막에좀그런게있지만 전체적으로봤을때는 정말명작이다 억지감동이아닌 진짜감동..연출도정말잘한거같다 
339,써니,2011,"코미디, 드라마",10, 언제 봐도 마음이 따뜻해지는 영화다. 
340,써니,2011,"코미디, 드라마",10, 아...열번봐도감동이다 소름돋아 
341,써니,2011,"코미디, 드라마",10, 욕이 찰져서 웃다가 마지막엔 울었네 
342,써니,2011,"코미디, 드라마",5," 추억팔이용 그이상은 아닌, "
343,써니,2011,"코미디, 드라마",10," 연기도 연출도 스토리도 감동 그 자체. 보면서 학창시절을 떠올리게 해주고, 친구들을, 잃어버린 꿈을 기억나게해주는 영화였다. "
344,써니,2011,"코미디, 드라마",8, 나도 내인생의 주인공이라는 말...슬프고 짠하네... 
345,써니,2011,"코미디, 드라마",10, 써니는진짜최고다봐도봐도너무좋고감동적인영화다 
346,써니,2011,"코미디, 드라마",8, 어릴적 주인공들의 연기가 좋다 
347,써니,2011,"코미디, 드라마",10, 최고임. 완전 재밌음. 배우들 연기 대박ㄷㄷㄷ 
348,써니,2011,"코미디, 드라마",10, 남자가보기엔 중간중간 오글거리는씬이 있었지만 전체적으로 완성도가 높음 특히 조연들의 연기력이 발군이다 
349,써니,2011,"코미디, 드라마",10," 너무 감동적인 영화네요. 엄청 웃고, 펑펑 울고, 정말 재밌게 봤습니다. "
350,써니,2011,"코미디, 드라마",7, 과속스캔들이 정말 오래 준비한 작품이란걸 알았다. 하지만 아직도 기대되는 강형철. 
351,써니,2011,"코미디, 드라마",7, 웃어라내가 태어났을때 세상이 나를 향해 웃어 주었을 것이다울어라내가 죽을때 웃어야만 세상이 나를 보고 울어 줄것이다 
352,써니,2011,"코미디, 드라마",10, 몇번이나 다시본. 또 다시보고싶은 감동적인영화다. 
353,써니,2011,"코미디, 드라마",8, 허풍도 적절한 그날의 향수 
354,써니,2011,"코미디, 드라마",9, 봐도봐도 역시 감동적이긴한데 .... 조금 더 넣었으면 하는 부분도 역시나 있긴하네요 조금 아쉽긴하지만 좋아요 
355,써니,2011,"코미디, 드라마",7, 심은경 매력철철넘치고 배우들 캐스팅은 잘했는데 내용은 그닥.. 흔히말하는 일진 미화 
356,써니,2011,"코미디, 드라마",10," 대박 캐스팅, 민효린 어른역만 빼면 완전 어렸을때이다가 어른일때 모습보면 진짜 크면 저렇겠다 싶었고, 감동까지 :) 너무 재밋게 봤습니다.요즘 영화 재미없었은데 신선했어요 :) 적극 추천 !! "
